,X1,X2,X3,X4,frequency
voluntary service state offered,voluntary,service,state,offered,2
volunteer park naturalist jeri,volunteer,park,naturalist,jeri,2
voss community betterment mary,voss,community,betterment,mary,2
vote water committee business,vote,water,committee,business,2
voted raising water rate,voted,raising,water,rate,2
voters cast mail ballots,voters,cast,mail,ballots,3
voters orange county study,voters,orange,county,study,3
voters polled also said,voters,polled,also,said,2
vowed step protests since,vowed,step,protests,since,2
w ‚Äì hoffman s,w,‚Äì,hoffman,s,2
wade court decision whether,wade,court,decision,whether,2
wage latest statistics us,wage,latest,statistics,us,2
wage workers casino hotels,wage,workers,casino,hotels,2
wainwright garcia working first,wainwright,garcia,working,first,2
wainwright health arts lisa,wainwright,health,arts,lisa,2
wainwright jaime garcia kyle,wainwright,jaime,garcia,kyle,2
wait september law mandating,wait,september,law,mandating,3
wait three days call,wait,three,days,call,2
waiting list organ transplant,waiting,list,organ,transplant,2
walden said trying just,walden,said,trying,just,2
walker kid can beat,walker,kid,can,beat,2
walkoff home run get,walkoff,home,run,get,2
wall plastered logical chronology,wall,plastered,logical,chronology,2
wall street says betting,wall,street,says,betting,2
walls social games like,walls,social,games,like,2
walsh fine threeyear start,walsh,fine,threeyear,start,2
walsh georgia walsh fine,walsh,georgia,walsh,fine,2
want good outcome said,want,good,outcome,said,2
want see democracy action,want,see,democracy,action,2
wanted something healthy address,wanted,something,healthy,address,2
wanted sunday night shooting,wanted,sunday,night,shooting,2
wants ask employers discriminate,wants,ask,employers,discriminate,2
wants goes friends say,wants,goes,friends,say,2
wants keep wnet million,wants,keep,wnet,million,2
wants match juggernaut nike,wants,match,juggernaut,nike,3
war ii civil rights,war,ii,civil,rights,2
war iraq namely islamic,war,iraq,namely,islamic,2
ware last words hate,ware,last,words,hate,2
warehousing space couldnt find,warehousing,space,couldnt,find,2
warning dark forces intent,warning,dark,forces,intent,2
warning lower north fork,warning,lower,north,fork,2
warriors opened season struggled,warriors,opened,season,struggled,2
wars raptor taller longer,wars,raptor,taller,longer,2
washington bridge learning hidden,washington,bridge,learning,hidden,3
washington county sheriffs office,washington,county,sheriffs,office,2
washington dc five grandchildren,washington,dc,five,grandchildren,2
washington state back ohio,washington,state,back,ohio,2
washington‚Äî supreme court said,washington‚Äî,supreme,court,said,2
wasnt case jan linda,wasnt,case,jan,linda,2
wasnt easy transition transportation,wasnt,easy,transition,transportation,3
wasnt great respect plants,wasnt,great,respect,plants,2
wasnt person met phone,wasnt,person,met,phone,2
wasnt released lewis said,wasnt,released,lewis,said,2
wasnt small plane informed,wasnt,small,plane,informed,2
waste bottlenecks boosting employee,waste,bottlenecks,boosting,employee,2
waste contains high level,waste,contains,high,level,2
waste distributing homeless shelters,waste,distributing,homeless,shelters,2
watch closely turn frequently,watch,closely,turn,frequently,4
watching brownsbengals game replay,watching,brownsbengals,game,replay,2
water committee business administrator,water,committee,business,administrator,2
water flake form can,water,flake,form,can,2
water moving speed moving,water,moving,speed,moving,2
water rate percent vote,water,rate,percent,vote,2
water supply cumberland manor,water,supply,cumberland,manor,2
watering hole kips bar,watering,hole,kips,bar,2
watering semineglect wouldnt leave,watering,semineglect,wouldnt,leave,2
watts make evaluations priority,watts,make,evaluations,priority,2
way even though early,way,even,though,early,2
way law certainly follow,way,law,certainly,follow,2
way margaret donnellys office,way,margaret,donnellys,office,2
way old mad crush,way,old,mad,crush,2
way state slowly strangling,way,state,slowly,strangling,2
way tells hes learned,way,tells,hes,learned,2
we‚Äôre disadvantage getting message,we‚Äôre,disadvantage,getting,message,2
we‚Äôre proud wish happiness,we‚Äôre,proud,wish,happiness,2
weather lawn work bike,weather,lawn,work,bike,2
web follow greatest point,web,follow,greatest,point,2
webcam allegedly set dorm,webcam,allegedly,set,dorm,3
weber state selected jody,weber,state,selected,jody,2
wedding sir elton john,wedding,sir,elton,john,2
wednesday afternoon police say,wednesday,afternoon,police,say,2
wednesday university maryland college,wednesday,university,maryland,college,2
week ago sponsor field,week,ago,sponsor,field,2
week hennes paynter assisted,week,hennes,paynter,assisted,2
week im sure peeta,week,im,sure,peeta,3
week lawmakers move curtail,week,lawmakers,move,curtail,2
week ran th highpowered,week,ran,th,highpowered,2
week report said adams,week,report,said,adams,2
week seek democratic nomination,week,seek,democratic,nomination,2
week tom points admission,week,tom,points,admission,3
week virginia tour april,week,virginia,tour,april,2
weekdays county‚Äôs central transfer,weekdays,county‚Äôs,central,transfer,2
weekend number abortions since,weekend,number,abortions,since,2
weekend traditionally dark one,weekend,traditionally,dark,one,2
weekend viewed event fantastic,weekend,viewed,event,fantastic,2
weight gain may push,weight,gain,may,push,2
weinberg said written notification,weinberg,said,written,notification,3
weinsoff vice mayor one,weinsoff,vice,mayor,one,2
weird donalds kicks flicks,weird,donalds,kicks,flicks,3
weird music selection len,weird,music,selection,len,3
weirdest thing happened season,weirdest,thing,happened,season,2
welcome butler university newest,welcome,butler,university,newest,2
welcoming throng president family,welcoming,throng,president,family,2
welfare marsha rusnack cultural,welfare,marsha,rusnack,cultural,2
well didn‚Äôt always play,well,didn‚Äôt,always,play,2
well new hampshire delaware,well,new,hampshire,delaware,2
well norton offers apologies,well,norton,offers,apologies,2
well pay fine careless,well,pay,fine,careless,2
well pro day benching,well,pro,day,benching,2
went different bars town,went,different,bars,town,2
went emptybackfield set texans,went,emptybackfield,set,texans,2
went extra innings mountain,went,extra,innings,mountain,2
went guy group friends,went,guy,group,friends,2
went law school shell,went,law,school,shell,2
went miles per hour,went,miles,per,hour,2
went pasadena independent school,went,pasadena,independent,school,2
went regular season playoffs,went,regular,season,playoffs,2
went road connecticut yacht,went,road,connecticut,yacht,2
went truthometer weekend number,went,truthometer,weekend,number,2
wesley matthews scorching beyond,wesley,matthews,scorching,beyond,2
west texas resort crossed,west,texas,resort,crossed,2
west watts make evaluations,west,watts,make,evaluations,2
westbrook entering final seasons,westbrook,entering,final,seasons,2
westbrook lohse westbrook entering,westbrook,lohse,westbrook,entering,2
westminster academy downed oviedo,westminster,academy,downed,oviedo,2
weve found something everyone,weve,found,something,everyone,2
weve share trouble theres,weve,share,trouble,theres,2
whatever clown suit armour,whatever,clown,suit,armour,3
whatever color apply face,whatever,color,apply,face,2
whatever gabriel wierzbicki‚Äôs parents,whatever,gabriel,wierzbicki‚Äôs,parents,2
whats available whats desired,whats,available,whats,desired,2
whats reported plans increase,whats,reported,plans,increase,3
wheels justice grinding california,wheels,justice,grinding,california,3
whether cuts tax rebates,whether,cuts,tax,rebates,2
whether harris can save,whether,harris,can,save,2
whether rental car amounts,whether,rental,car,amounts,2
white answered ill leave,white,answered,ill,leave,2
whoa three different girlfriends,whoa,three,different,girlfriends,2
whole foods locations tustin,whole,foods,locations,tustin,2
whole idea pacs becoming,whole,idea,pacs,becoming,2
whole mythology detroit structures,whole,mythology,detroit,structures,2
whopping six eight thirddown,whopping,six,eight,thirddown,2
whose name wasnt released,whose,name,wasnt,released,2
wide hips now people,wide,hips,now,people,2
widen blocked heart vessels,widen,blocked,heart,vessels,2
wider audience might think,wider,audience,might,think,2
wierzbicki‚Äôs parents wrote beside,wierzbicki‚Äôs,parents,wrote,beside,2
wife brother father decided,wife,brother,father,decided,2
wife living room bill,wife,living,room,bill,2
wilberforce national afroamerican museum,wilberforce,national,afroamerican,museum,2
wilderness superior international junior,wilderness,superior,international,junior,2
wildfire going house receive,wildfire,going,house,receive,2
wildfire threatening rugged west,wildfire,threatening,rugged,west,2
wildly adored one although,wildly,adored,one,although,2
william b ittner school,william,b,ittner,school,2
william saroyan another shelf,william,saroyan,another,shelf,2
william wyler truly knew,william,wyler,truly,knew,2
williamsburg years historic garden,williamsburg,years,historic,garden,2
willing go serve public,willing,go,serve,public,2
willing help fb need,willing,help,fb,need,2
willing sit work issues,willing,sit,work,issues,2
willing tell us find,willing,tell,us,find,2
win additional goal nice,win,additional,goal,nice,2
win lions share market,win,lions,share,market,2
win lutheran south invitational,win,lutheran,south,invitational,2
win orioles skipper former,win,orioles,skipper,former,2
win snap dallas game,win,snap,dallas,game,2
wincing ouch song stay,wincing,ouch,song,stay,3
window portable classroom containing,window,portable,classroom,containing,2
windsor sued federal government,windsor,sued,federal,government,2
wine hard novice negotiate,wine,hard,novice,negotiate,2
wink film just another,wink,film,just,another,2
wink wink film just,wink,wink,film,just,2
winner drawn monday notified,winner,drawn,monday,notified,2
winner food recovery network,winner,food,recovery,network,2
winner raptor score cedar,winner,raptor,score,cedar,2
winner unavailable prize fulfillment,winner,unavailable,prize,fulfillment,2
winner unreachable seven days,winner,unreachable,seven,days,2
winter park advanced face,winter,park,advanced,face,2
wisconsin wilderness superior international,wisconsin,wilderness,superior,international,2
wish happiness whatever gabriel,wish,happiness,whatever,gabriel,2
within important geographic footprint,within,important,geographic,footprint,2
without adding special options,without,adding,special,options,2
without foundation powder first,without,foundation,powder,first,2
without little homework buying,without,little,homework,buying,2
without question inspired hopes,without,question,inspired,hopes,2
witness away spotlight proceedings,witness,away,spotlight,proceedings,2
witness police investigation began,witness,police,investigation,began,2
witnesses clerks bailiffs use,witnesses,clerks,bailiffs,use,2
wnet million addition million,wnet,million,addition,million,2
wnet president neal shapiro,wnet,president,neal,shapiro,2
woes continue atlanta mike,woes,continue,atlanta,mike,2
woke id changing mind,woke,id,changing,mind,2
woman returned truck fled,woman,returned,truck,fled,2
woman‚Äôs club roland park,woman‚Äôs,club,roland,park,2
womans body moved bank,womans,body,moved,bank,2
women added high danger,women,added,high,danger,2
women percent men point,women,percent,men,point,2
women recognized areas achievement,women,recognized,areas,achievement,2
women run trains engineers,women,run,trains,engineers,2
women wide hips now,women,wide,hips,now,2
won award excellence teaching,won,award,excellence,teaching,2
won grammy awards seven,won,grammy,awards,seven,2
won percent women percent,won,percent,women,percent,2
wonder bothered connection really,wonder,bothered,connection,really,2
wonder property taxes high‚Äù,wonder,property,taxes,high‚Äù,2
wondering eyes smoothing uneven,wondering,eyes,smoothing,uneven,2
wont affect private property,wont,affect,private,property,2
wont take drastic steps,wont,take,drastic,steps,2
wooden block artistically arranged,wooden,block,artistically,arranged,2
wooden ferry house erected,wooden,ferry,house,erected,3
woods officers found mother,woods,officers,found,mother,3
words hate games wait,words,hate,games,wait,2
work bending little less,work,bending,little,less,2
work bike riding townhouse,work,bike,riding,townhouse,2
work commitment says david,work,commitment,says,david,2
work desire really frustration,work,desire,really,frustration,2
work issues accomplish something,work,issues,accomplish,something,2
work three three low,work,three,three,low,2
worked france wasnt great,worked,france,wasnt,great,2
worked hard restore relationship,worked,hard,restore,relationship,2
workers casino hotels translating,workers,casino,hotels,translating,2
workers just months defeat,workers,just,months,defeat,2
workers residents depend bus,workers,residents,depend,bus,2
working cider mills petting,working,cider,mills,petting,2
working city buses left,working,city,buses,left,2
working council council working,working,council,council,working,2
working first installment extensions,working,first,installment,extensions,2
working people poor elderly,working,people,poor,elderly,2
working public often say,working,public,often,say,2
works longtime berkeley watering,works,longtime,berkeley,watering,2
works national oceanic atmospheric,works,national,oceanic,atmospheric,2
world class manufacturing system,world,class,manufacturing,system,2
world talking even wants,world,talking,even,wants,3
world talking plank defiantly,world,talking,plank,defiantly,3
world war ii civil,world,war,ii,civil,2
worries getting tapped unable,worries,getting,tapped,unable,2
worry congress let tax,worry,congress,let,tax,2
worst date dj called,worst,date,dj,called,2
wouldnt leave child without,wouldnt,leave,child,without,2
wrestling jan never kind,wrestling,jan,never,kind,2
wrigleyville knock many bars,wrigleyville,knock,many,bars,2
wrinkles step takes less,wrinkles,step,takes,less,2
writing fifthgrade science curriculum,writing,fifthgrade,science,curriculum,2
writing refreshingly sophisticated old,writing,refreshingly,sophisticated,old,2
written notification legislators sufficient,written,notification,legislators,sufficient,3
wrote beside picture son,wrote,beside,picture,son,2
wwwmedinakiwanisorg call jim haymond,wwwmedinakiwanisorg,call,jim,haymond,2
wyler truly knew keep,wyler,truly,knew,keep,2
xavier team proved numerous,xavier,team,proved,numerous,2
yacht basin puccio teaching,yacht,basin,puccio,teaching,2
yankees manager buck showalter,yankees,manager,buck,showalter,2
yeah feels fast time,yeah,feels,fast,time,2
year anticipated still million,year,anticipated,still,million,2
year closed correspondent division,year,closed,correspondent,division,2
year companies list grew,year,companies,list,grew,3
year dont technology built,year,dont,technology,built,2
year encourage towns merge,year,encourage,towns,merge,2
year force recognition late,year,force,recognition,late,2
year gov chris christie‚Äôs,year,gov,chris,christie‚Äôs,2
year new jersey spend,year,new,jersey,spend,2
year plans add new,year,plans,add,new,2
year playing wisconsin wilderness,year,playing,wisconsin,wilderness,2
year real estate developers,year,real,estate,developers,2
year relationship new york,year,relationship,new,york,2
year republican steve stivers,year,republican,steve,stivers,2
year shackleford finished fourth,year,shackleford,finished,fourth,2
year short kings season,year,short,kings,season,2
year supposedly avoid financial,year,supposedly,avoid,financial,2
year tax battle election,year,tax,battle,election,2
year treasury note rose,year,treasury,note,rose,2
year unexpectedly announced resignation,year,unexpectedly,announced,resignation,2
year worries getting tapped,year,worries,getting,tapped,2
yearlong deployment began another,yearlong,deployment,began,another,2
yearold experienced kayaker may,yearold,experienced,kayaker,may,2
yearold freshman jumped george,yearold,freshman,jumped,george,3
yearold girl yearold boy,yearold,girl,yearold,boy,2
yearold girl yearold girl,yearold,girl,yearold,girl,2
yearold institution hired drumroll,yearold,institution,hired,drumroll,2
yearold man arrested detroit,yearold,man,arrested,detroit,2
yearold shirley ann caesar,yearold,shirley,ann,caesar,2
yearold wanted sunday night,yearold,wanted,sunday,night,2
years according shareholder activist,years,according,shareholder,activist,2
years ago help boost,years,ago,help,boost,2
years ago much horror,years,ago,much,horror,2
years chrysler introduced fiats,years,chrysler,introduced,fiats,2
years discussed concern even,years,discussed,concern,even,2
years everyone older tdap,years,everyone,older,tdap,2
years historic garden week,years,historic,garden,week,2
years lord knows plenty,years,lord,knows,plenty,2
years must repay county,years,must,repay,county,2
years old guardian cheyenne,years,old,guardian,cheyenne,2
years princeton university various,years,princeton,university,various,3
years rock roll hall,years,rock,roll,hall,2
years second marriage carol,years,second,marriage,carol,2
years younger chronological age,years,younger,chronological,age,2
yesterday marked th anniversary,yesterday,marked,th,anniversary,2
yet another threat government,yet,another,threat,government,2
yet hit market trend,yet,hit,market,trend,2
yet shareholders left many,yet,shareholders,left,many,2
yield year treasury note,yield,year,treasury,note,2
yielded one run burlaga,yielded,one,run,burlaga,2
york ‚Äî place loss,york,‚Äî,place,loss,2
york alcoholic abusive toward,york,alcoholic,abusive,toward,2
york city four years,york,city,four,years,2
york involves edith windsor,york,involves,edith,windsor,2
yorkbased aol inc also,yorkbased,aol,inc,also,2
yorker contains john colapintos,yorker,contains,john,colapintos,2
young faces number important,young,faces,number,important,2
young people met even,young,people,met,even,2
youre going match going,youre,going,match,going,2
youre place life realize,youre,place,life,realize,2
youre poor eater just,youre,poor,eater,just,2
youre probably wondering eyes,youre,probably,wondering,eyes,2
youth dedication sandra lauschke,youth,dedication,sandra,lauschke,2
youve got artist isnt,youve,got,artist,isnt,2
yoyo professionals local sports,yoyo,professionals,local,sports,2
zaun delanco shot trooper,zaun,delanco,shot,trooper,2
ziegler ended divorce child,ziegler,ended,divorce,child,2
zimmerman neighborhood watch volunteer,zimmerman,neighborhood,watch,volunteer,2
zoe lofgren dcalif takes,zoe,lofgren,dcalif,takes,2
zone told players play,zone,told,players,play,2
zoo yoyo professionals local,zoo,yoyo,professionals,local,2
‚ñ husbands engines whip,‚ñ,husbands,engines,whip,2
‚ñ one highly anticipated,‚ñ,one,highly,anticipated,2
„∏ dont know figure,„∏,dont,know,figure,2
„∏just bank hasnt raised,„∏just,bank,hasnt,raised,2
„∏two things happened past,„∏two,things,happened,past,2
‚Äò‚Äò frustrating lose player,‚Äò‚Äò,frustrating,lose,player,2
‚Äòaah mom theres possums,‚Äòaah,mom,theres,possums,2
‚Äì beths politically connected,‚Äì,beths,politically,connected,3
‚Äì didnt keep getting,‚Äì,didnt,keep,getting,3
‚Äî biggest brightest full,‚Äî,biggest,brightest,full,2
‚Äî elling ‚Äî redtwist,‚Äî,elling,‚Äî,redtwist,2
‚Äî gov chris christie,‚Äî,gov,chris,christie,2
‚Äî griffin theatre company,‚Äî,griffin,theatre,company,2
‚Äî perhaps time enough,‚Äî,perhaps,time,enough,2
‚Äî prairie fire ‚Äî,‚Äî,prairie,fire,‚Äî,2
‚Äî released wednesday supervision,‚Äî,released,wednesday,supervision,2
‚Äî required percent ‚Äî,‚Äî,required,percent,‚Äî,2
‚Äî sixyear absence prairie,‚Äî,sixyear,absence,prairie,2
‚Äî specifically lack evidence,‚Äî,specifically,lack,evidence,2
‚Äî theres plenty remind,‚Äî,theres,plenty,remind,2
‚Äî think annapolis queen,‚Äî,think,annapolis,queen,2
‚Äî township girl scout,‚Äî,township,girl,scout,2
‚Äî war pestilence famine,‚Äî,war,pestilence,famine,2
‚Äú food line everything‚Äù,‚Äú,food,line,everything‚Äù,2
‚Äú government‚Äù replies tyner,‚Äú,government‚Äù,replies,tyner,2
‚Äú it‚Äù jeanette said,‚Äú,it‚Äù,jeanette,said,2
‚Äú personally reminded anaheim,‚Äú,personally,reminded,anaheim,2
‚Äú think project success,‚Äú,think,project,success,2
‚Äú thinking calling splendid,‚Äú,thinking,calling,splendid,2
‚Äú trying get tight,‚Äú,trying,get,tight,2
‚Äúbig bosses‚Äù staying behind,‚Äúbig,bosses‚Äù,staying,behind,2
‚Äúeveryone wants play college,‚Äúeveryone,wants,play,college,2
‚Äúi‚Äôm excited it‚Äù said,‚Äúi‚Äôm,excited,it‚Äù,said,2
‚Äúi‚Äôm proud basically achieved,‚Äúi‚Äôm,proud,basically,achieved,2
‚Äúi‚Äôve long prepared moment,‚Äúi‚Äôve,long,prepared,moment,2
‚Äúit‚Äôs fortune company wellrespected,‚Äúit‚Äôs,fortune,company,wellrespected,2
‚Äúwe‚Äôre fortunate pitchers can,‚Äúwe‚Äôre,fortunate,pitchers,can,2
‚Äúwho‚Äôs afraid virginia woolf‚Äù,‚Äúwho‚Äôs,afraid,virginia,woolf‚Äù,2
aaron younger prevailed time,aaron,younger,prevailed,time,2
aarp transactions take time,aarp,transactions,take,time,2
ab consumption alcoholopen container,ab,consumption,alcoholopen,container,2
abandoned attempts address problem,abandoned,attempts,address,problem,2
abandoned threats abandoned attempts,abandoned,threats,abandoned,attempts,2
abandoned ultimatums abandoned threats,abandoned,ultimatums,abandoned,threats,2
abatements former jersey city,abatements,former,jersey,city,2
able come agreement restructured,able,come,agreement,restructured,2
able find ways avoid,able,find,ways,avoid,2
able get going offensively,able,get,going,offensively,2
able kids program like,able,kids,program,like,2
able play game hes,able,play,game,hes,2
able say well airplane,able,say,well,airplane,2
aboard american airlines flight,aboard,american,airlines,flight,2
abortions abuses community part,abortions,abuses,community,part,2
abreu million season franchise,abreu,million,season,franchise,2
absence prairie fire handsome,absence,prairie,fire,handsome,2
absent knicks postseason anthony,absent,knicks,postseason,anthony,2
absolutely comfortable samesex couples,absolutely,comfortable,samesex,couples,2
abuse comes light though,abuse,comes,light,though,2
abuse daily across county,abuse,daily,across,county,2
abusers like case tyesha,abusers,like,case,tyesha,2
abuses community part chinas,abuses,community,part,chinas,2
accelerate plans vice president,accelerate,plans,vice,president,2
accent thick dirty true,accent,thick,dirty,TRUE,2
accepted real story ethan,accepted,real,story,ethan,2
access jerusalem west bank,access,jerusalem,west,bank,2
accessible everyone succeed flying,accessible,everyone,succeed,flying,2
accidental left interior home,accidental,left,interior,home,2
according matthews spokesman national,according,matthews,spokesman,national,2
according recent polls netanyahu,according,recent,polls,netanyahu,2
account associated bank underlies,account,associated,bank,underlies,2
accounted percent companys revenue,accounted,percent,companys,revenue,2
accounts good news customers,accounts,good,news,customers,2
accurately say can like,accurately,say,can,like,2
achieve‚Äù baez said ‚Äúeveryone,achieve‚Äù,baez,said,‚Äúeveryone,2
achieved everyone else trying,achieved,everyone,else,trying,2
acknowledge violent crime dropped,acknowledge,violent,crime,dropped,2
acknowledged theres bubble bubble,acknowledged,theres,bubble,bubble,2
acknowledges contract disputes reality,acknowledges,contract,disputes,reality,2
aclu new york none,aclu,new,york,none,2
acquitted meadows attempted murder,acquitted,meadows,attempted,murder,2
acres kennels se foster,acres,kennels,se,foster,2
across county abuse comes,across,county,abuse,comes,2
across nation allentown pennsylvania,across,nation,allentown,pennsylvania,2
across state next months,across,state,next,months,2
act valor expand beyond,act,valor,expand,beyond,2
acta sent make sure,acta,sent,make,sure,2
actions worse situation theyre,actions,worse,situation,theyre,2
activities featured third annual,activities,featured,third,annual,2
activities radio disney close,activities,radio,disney,close,2
actually cracked powder coating,actually,cracked,powder,coating,2
adams good kid made,adams,good,kid,made,2
adams tested positive marijuana,adams,tested,positive,marijuana,2
adapt said constant life,adapt,said,constant,life,2
adaptation philip pullmans fantasy,adaptation,philip,pullmans,fantasy,2
added third shift lordstown,added,third,shift,lordstown,2
addition chorizo make great,addition,chorizo,make,great,2
addition city‚Äôs current interim,addition,city‚Äôs,current,interim,2
additional parttime employees election,additional,parttime,employees,election,2
address problem making unilateral,address,problem,making,unilateral,2
adds vital notech methods,adds,vital,notech,methods,2
administration bought property movie,administration,bought,property,movie,2
