,X1,X2,X3,X4,frequency
jumping fish escort ship,jumping,fish,escort,ship,2
june adams town week,june,adams,town,week,2
june lasted two hours,june,lasted,two,hours,2
june talmage lord highlands,june,talmage,lord,highlands,2
june time boards attorney,june,time,boards,attorney,2
junior hockey league calabrese,junior,hockey,league,calabrese,2
junior opened season ‚Äì,junior,opened,season,‚Äì,2
junior told chronicle tuesday,junior,told,chronicle,tuesday,2
juniper trees homes tucked,juniper,trees,homes,tucked,2
junkies every available wall,junkies,every,available,wall,2
just ‚Äî weird guess,just,‚Äî,weird,guess,2
just acknowledgement way old,just,acknowledgement,way,old,2
just advanced version blues,just,advanced,version,blues,2
just another excuse inflict,just,another,excuse,inflict,2
just brand name wildly,just,brand,name,wildly,2
just break go healthy,just,break,go,healthy,2
just bury zone told,just,bury,zone,told,2
just cant fund amount,just,cant,fund,amount,2
just don‚Äôt like way,just,don‚Äôt,like,way,2
just east albuquerque mountainside,just,east,albuquerque,mountainside,2
just every day ive,just,every,day,ive,2
just everything else happened,just,everything,else,happened,2
just feel like im,just,feel,like,im,2
just forget allens walkoff,just,forget,allens,walkoff,2
just fun hanging people,just,fun,hanging,people,2
just hope touch comes,just,hope,touch,comes,2
just kings playing superior,just,kings,playing,superior,2
just know like feel,just,know,like,feel,2
just like eating right,just,like,eating,right,2
just like whoa three,just,like,whoa,three,2
just months defeat polls,just,months,defeat,polls,2
just one person dont,just,one,person,dont,2
just two weeks ago,just,two,weeks,ago,2
just went different bars,just,went,different,bars,2
just work bending little,just,work,bending,little,2
justice emotional trauma follows,justice,emotional,trauma,follows,2
justice grinding california one,justice,grinding,california,one,3
justified cutting jerusalem neighborhoods,justified,cutting,jerusalem,neighborhoods,2
kait said executives companies,kait,said,executives,companies,2
kansas city chiefs cheerleader,kansas,city,chiefs,cheerleader,2
kansas city job kansas,kansas,city,job,kansas,2
kansas state university betty,kansas,state,university,betty,2
kavanagh rfountain hills sponsored,kavanagh,rfountain,hills,sponsored,2
kayaker may paddled close,kayaker,may,paddled,close,2
kean years princeton university,kean,years,princeton,university,3
keep bette davis check,keep,bette,davis,check,2
keep famous ‚Äî sympathetic,keep,famous,‚Äî,sympathetic,2
keep new round inflation,keep,new,round,inflation,2
keep wnet million addition,keep,wnet,million,addition,2
keeping pirates balance three,keeping,pirates,balance,three,2
keeps shining traffic beating,keeps,shining,traffic,beating,2
kelley active marketing mail,kelley,active,marketing,mail,3
kelley last week hennes,kelley,last,week,hennes,2
kemba walker kid can,kemba,walker,kid,can,2
kendrea age town kansas,kendrea,age,town,kansas,2
kept many investors away,kept,many,investors,away,2
kevin bacon brought star,kevin,bacon,brought,star,2
key injuries big free,key,injuries,big,free,2
key vitel said just,key,vitel,said,just,2
kickball introduced opposing player,kickball,introduced,opposing,player,2
kicker notables danny hrapmann,kicker,notables,danny,hrapmann,2
kicks flicks high highenergy,kicks,flicks,high,highenergy,3
kid can beat teams,kid,can,beat,teams,2
kids ages years old,kids,ages,years,old,2
kids including sports fitness,kids,including,sports,fitness,2
kids konnecting nature tweeting,kids,konnecting,nature,tweeting,2
kill sons desire pushing,kill,sons,desire,pushing,2
kilroy ousted last year,kilroy,ousted,last,year,2
kilroy run congress three,kilroy,run,congress,three,2
kilroy told columbus dispatch,kilroy,told,columbus,dispatch,2
kimberly ritter human welfare,kimberly,ritter,human,welfare,2
kimi raikkonen also great,kimi,raikkonen,also,great,2
kind father kill sons,kind,father,kill,sons,2
kingdom halflength win preakness,kingdom,halflength,win,preakness,2
kings along progression curve,kings,along,progression,curve,2
kings blues similar system,kings,blues,similar,system,2
kings just advanced version,kings,just,advanced,version,2
kings playing superior version,kings,playing,superior,version,2
kings season able blues,kings,season,able,blues,2
kings speech alexandre desplat,kings,speech,alexandre,desplat,2
kings third consecutive excursion,kings,third,consecutive,excursion,2
kips bar durant ave,kips,bar,durant,ave,2
kirk lewis officer said,kirk,lewis,officer,said,2
kleekamp said nice see,kleekamp,said,nice,see,2
kloos cleveland heights organized,kloos,cleveland,heights,organized,2
knee injury knicks rollercoaster,knee,injury,knicks,rollercoaster,2
knew gray gift wrestling,knew,gray,gift,wrestling,2
knew keep bette davis,knew,keep,bette,davis,2
knicks last season lee,knicks,last,season,lee,2
knicks rollercoaster ride continued,knicks,rollercoaster,ride,continued,2
knock many bars line,knock,many,bars,line,2
know dont sit figure,know,dont,sit,figure,2
know feel theres connection,know,feel,theres,connection,2
know heritage oak private,know,heritage,oak,private,2
know im cheerleader dont,know,im,cheerleader,dont,2
know like feel heart,know,like,feel,heart,2
know open heart thoughts,know,open,heart,thoughts,2
knowing gleesons presence looms,knowing,gleesons,presence,looms,2
known critical incidents men,known,critical,incidents,men,2
known th street name,known,th,street,name,2
knows anything quickstep given,knows,anything,quickstep,given,3
knows hell need world,knows,hell,need,world,3
knows plenty one start,knows,plenty,one,start,2
knows wants goes friends,knows,wants,goes,friends,2
konnecting nature tweeting birds,konnecting,nature,tweeting,birds,2
kroll said hourly reports,kroll,said,hourly,reports,2
krysti henke republican running,krysti,henke,republican,running,2
ktrss mcgraw milhaven emceed,ktrss,mcgraw,milhaven,emceed,2
kyle lohse jake westbrook,kyle,lohse,jake,westbrook,2
l ‚Äì shenasi dey,l,‚Äì,shenasi,dey,2
l smith smith left,l,smith,smith,left,2
labor confederations also held,labor,confederations,also,held,2
labor day weekend viewed,labor,day,weekend,viewed,2
labor improvements flexible production,labor,improvements,flexible,production,2
labutes acidic reasons pretty,labutes,acidic,reasons,pretty,2
lacledes landing big bars,lacledes,landing,big,bars,2
lady gospel yearold shirley,lady,gospel,yearold,shirley,2
laguna beach huntington beach,laguna,beach,huntington,beach,2
laid across new jersey,laid,across,new,jersey,2
lakes posing human health,lakes,posing,human,health,2
lamps one made can,lamps,one,made,can,2
land cute flashbacks violet,land,cute,flashbacks,violet,2
landing big bars surrounding,landing,big,bars,surrounding,2
landmark roe v wade,landmark,roe,v,wade,2
langsam shuman community service,langsam,shuman,community,service,2
language elliptical story american,language,elliptical,story,american,2
language frankly better synopsis,language,frankly,better,synopsis,2
lap minute seconds became,lap,minute,seconds,became,2
large heavy saucepan heat,large,heavy,saucepan,heat,2
large salad bowl add,large,salad,bowl,add,2
larger campaigns bad idea‚Äù,larger,campaigns,bad,idea‚Äù,2
larger eight people now,larger,eight,people,now,2
largest teachers union plans,largest,teachers,union,plans,2
larry goldstein leading stem,larry,goldstein,leading,stem,3
larsen told way margaret,larsen,told,way,margaret,2
laser beams even insects,laser,beams,even,insects,2
last century renowned st,last,century,renowned,st,2
last fall christopher cerf‚Äôs,last,fall,christopher,cerf‚Äôs,3
last month borough council,last,month,borough,council,2
last month learned meeting,last,month,learned,meeting,2
last month legacy meridian,last,month,legacy,meridian,2
last month postponed request,last,month,postponed,request,2
last national league era,last,national,league,era,2
last season lee never,last,season,lee,never,2
last three home games,last,three,home,games,2
last week hennes paynter,last,week,hennes,paynter,2
last week im sure,last,week,im,sure,3
last week ran th,last,week,ran,th,2
last week seek democratic,last,week,seek,democratic,2
last week tom points,last,week,tom,points,3
last words hate games,last,words,hate,games,2
last year closed correspondent,last,year,closed,correspondent,2
last year companies list,last,year,companies,list,3
last year force recognition,last,year,force,recognition,2
last year million million,last,year,million,million,2
last year real estate,last,year,real,estate,2
last year republican steve,last,year,republican,steve,2
last year shackleford finished,last,year,shackleford,finished,2
last year supposedly avoid,last,year,supposedly,avoid,2
last years discussed concern,last,years,discussed,concern,2
lasted long since dwight,lasted,long,since,dwight,2
lasted two hours done,lasted,two,hours,done,2
late harvest sauvignon blanc,late,harvest,sauvignon,blanc,2
late spouse thea spyer,late,spouse,thea,spyer,2
later back board school,later,back,board,school,2
later crestfallen look courics,later,crestfallen,look,courics,2
later founded another protest,later,founded,another,protest,2
later really dont think,later,really,dont,think,2
later searching several acres,later,searching,several,acres,3
latest statistics us bureau,latest,statistics,us,bureau,2
latest technology electricity massive,latest,technology,electricity,massive,2
lauderdale westminster academy downed,lauderdale,westminster,academy,downed,2
launched september company donated,launched,september,company,donated,2
lauschke health concerns kimberly,lauschke,health,concerns,kimberly,2
law certainly follow law,law,certainly,follow,law,2
law enforcement officers purchasing,law,enforcement,officers,purchasing,2
law exists make sure,law,exists,make,sure,2
law mandating collection sales,law,mandating,collection,sales,3
law school shell intelligent,law,school,shell,intelligent,2
lawmakers move curtail public,lawmakers,move,curtail,public,2
lawn work bike riding,lawn,work,bike,riding,2
lawrence officer followed vehicle,lawrence,officer,followed,vehicle,2
laws intentions prevent highly,laws,intentions,prevent,highly,2
lawson case vindictive prosecution,lawson,case,vindictive,prosecution,2
lawyer failed advise risk,lawyer,failed,advise,risk,2
lawyer manhattan beach daughter,lawyer,manhattan,beach,daughter,2
lawyers others take parts,lawyers,others,take,parts,2
layer black bamboo ash,layer,black,bamboo,ash,2
le mans series international,le,mans,series,international,2
lead analysis technique abandoned,lead,analysis,technique,abandoned,2
lead teacher balanced literacy,lead,teacher,balanced,literacy,2
lead teacher writing fifthgrade,lead,teacher,writing,fifthgrade,2
leading stem cell scientist,leading,stem,cell,scientist,3
leads three see nets,leads,three,see,nets,2
league binder made skill,league,binder,made,skill,2
league calabrese also focused,league,calabrese,also,focused,2
league commissioner bernadette mcglade,league,commissioner,bernadette,mcglade,2
league era ‚Äî continued,league,era,‚Äî,continued,2
league life shortened reason,league,life,shortened,reason,2
leah askey one two,leah,askey,one,two,2
leapt headed shot columbus‚Äô,leapt,headed,shot,columbus‚Äô,2
learned meeting announced withdrawal,learned,meeting,announced,withdrawal,2
learned nothing mistakes jeremiah,learned,nothing,mistakes,jeremiah,2
learning hidden webcam allegedly,learning,hidden,webcam,allegedly,3
lease either chevrolet honda,lease,either,chevrolet,honda,2
lease payment one pay,lease,payment,one,pay,2
leave child without water,leave,child,without,water,2
leave navy served uss,leave,navy,served,uss,2
lebron james tweeted oh,lebron,james,tweeted,oh,3
led companies put stock,led,companies,put,stock,2
led group investors purchased,led,group,investors,purchased,2
led holden northampton county,led,holden,northampton,county,2
lee missed eight games,lee,missed,eight,games,2
lee never shot percent,lee,never,shot,percent,2
left fun johnson said,left,fun,johnson,said,2
left many bills unpaid,left,many,bills,unpaid,2
left monday take arkansas,left,monday,take,arkansas,2
left throw us time,left,throw,us,time,2
left us relieved says,left,us,relieved,says,2
legacy meridian park hospital,legacy,meridian,park,hospital,2
legal complaint accused mediapart,legal,complaint,accused,mediapart,2
legal immigrant faces deportation,legal,immigrant,faces,deportation,2
legal resident charged mail,legal,resident,charged,mail,2
legend rock soul award,legend,rock,soul,award,2
legendary basement tapes produced,legendary,basement,tapes,produced,2
legislation introduced delaware died,legislation,introduced,delaware,died,2
len apologizes donald says,len,apologizes,donald,says,3
lenders accounted half bofa‚Äôs,lenders,accounted,half,bofa‚Äôs,2
lengths protect including driving,lengths,protect,including,driving,2
lent madness forward movement,lent,madness,forward,movement,2
leroy scott dr near,leroy,scott,dr,near,2
less getting game full,less,getting,game,full,2
less minute dot liquid,less,minute,dot,liquid,2
less money coming time,less,money,coming,time,2
less one month can,less,one,month,can,2
less year anticipated still,less,year,anticipated,still,2
let know dont sit,let,know,dont,sit,2
let know feel theres,let,know,feel,theres,2
let tax breaks dividends,let,tax,breaks,dividends,2
lets just hope touch,lets,just,hope,touch,2
letterpress trays new alphabet,letterpress,trays,new,alphabet,2
lettuce large salad bowl,lettuce,large,salad,bowl,2
level allows higher compensation,level,allows,higher,compensation,2
level emotional honesty refreshingly,level,emotional,honesty,refreshingly,2
level extensive mileage postseason,level,extensive,mileage,postseason,2
level fun team elite,level,fun,team,elite,2
level individual fun intense,level,individual,fun,intense,2
level moment like becomes,level,moment,like,becomes,2
level nitrate liquid form,level,nitrate,liquid,form,2
level swimming ability near,level,swimming,ability,near,2
level writing refreshingly sophisticated,level,writing,refreshingly,sophisticated,2
levied cleveland housing court,levied,cleveland,housing,court,2
lewis officer said felt,lewis,officer,said,felt,2
lewis‚Äô account saying it‚Äôs,lewis‚Äô,account,saying,it‚Äôs,2
liabilities billion end company‚ís,liabilities,billion,end,company‚ís,2
lieu simple td booster,lieu,simple,td,booster,2
life like small school,life,like,small,school,2
life realize everything isnt,life,realize,everything,isnt,2
life shortened reason feel,life,shortened,reason,feel,2
life winner food recovery,life,winner,food,recovery,2
light number fellow officers,light,number,fellow,officers,2
like amazon scheduled go,like,amazon,scheduled,go,3
like bad boys deal‚î,like,bad,boys,deal‚î,2
like becomes huge words,like,becomes,huge,words,2
like chess checkers cards,like,chess,checkers,cards,2
like chess pieces new,like,chess,pieces,new,3
like college preparatory school,like,college,preparatory,school,2
like eating right youre,like,eating,right,youre,2
like expand schools saying,like,expand,schools,saying,2
like feel heart might,like,feel,heart,might,2
like guy im going,like,guy,im,going,2
like guys take initiative,like,guys,take,initiative,2
like hitch said didnt,like,hitch,said,didnt,2
like it‚Äôs long slow,like,it‚Äôs,long,slow,2
like jump street wonder,like,jump,street,wonder,2
like keep famous ‚Äî,like,keep,famous,‚Äî,2
like knew way tied,like,knew,way,tied,2
like let know dont,like,let,know,dont,2
like like guy im,like,like,guy,im,2
like long arms big,like,long,arms,big,2
like project based opposed,like,project,based,opposed,2
like prove something shes,like,prove,something,shes,2
like small also gets,like,small,also,gets,3
like small school sophomore,like,small,school,sophomore,2
like soccer basketball tennis,like,soccer,basketball,tennis,2
like sonia miller samuel,like,sonia,miller,samuel,2
like system thats system,like,system,thats,system,3
like vaughan coltrane toni,like,vaughan,coltrane,toni,2
like wasnt person met,like,wasnt,person,met,2
like way law certainly,like,way,law,certainly,2
like whoa three different,like,whoa,three,different,2
liked worst date dj,liked,worst,date,dj,2
likely met may first,likely,met,may,first,2
likes nike poster boy,likes,nike,poster,boy,3
limbaughs wedding sir elton,limbaughs,wedding,sir,elton,2
limits unionized public workers,limits,unionized,public,workers,2
lin sidelined knee injury,lin,sidelined,knee,injury,2
lincoln county volmert lone,lincoln,county,volmert,lone,2
linda maynard indulgent catering,linda,maynard,indulgent,catering,2
lindberg smoky hill castelino,lindberg,smoky,hill,castelino,2
line clark street just,line,clark,street,just,2
linemen across country recruiting,linemen,across,country,recruiting,2
linemen five florida texas,linemen,five,florida,texas,2
linemen oregon isnt trying,linemen,oregon,isnt,trying,2
linens vintage lamps one,linens,vintage,lamps,one,2
lines built stop firefighters,lines,built,stop,firefighters,2
lines farther east wont,lines,farther,east,wont,2
lions like long arms,lions,like,long,arms,2
liquid concealer clean finger,liquid,concealer,clean,finger,2
liquid form can contaminate,liquid,form,can,contaminate,2
liquids chinook county health,liquids,chinook,county,health,2
lisa orden zarin youth,lisa,orden,zarin,youth,2
lisbon portugals two main,lisbon,portugals,two,main,2
list annie drane nerys,list,annie,drane,nerys,2
list doesnt love beers,list,doesnt,love,beers,2
list grew headcounts average,list,grew,headcounts,average,3
list hospitalsafety data last,list,hospitalsafety,data,last,2
list including designed guide,list,including,designed,guide,2
list organ transplant many,list,organ,transplant,many,2
listed morrison instead littleton,listed,morrison,instead,littleton,2
literacy districts lead teacher,literacy,districts,lead,teacher,2
litigation perhaps content wait,litigation,perhaps,content,wait,3
little boy serious expression,little,boy,serious,expression,2
little homework buying individual,little,homework,buying,individual,2
little less getting game,little,less,getting,game,2
lived suburb hamtramck moving,lived,suburb,hamtramck,moving,2
lives new york alcoholic,lives,new,york,alcoholic,2
living dallas hinted odom,living,dallas,hinted,odom,2
living extremely filthy conditions,living,extremely,filthy,conditions,2
living loud gala auction,living,loud,gala,auction,2
living room bill lockyer,living,room,bill,lockyer,2
llc american medical response,llc,american,medical,response,2
llc bought jamestown mall,llc,bought,jamestown,mall,2
loading teams players ‚ñ,loading,teams,players,‚ñ,2
loans bulk smaller mortgage,loans,bulk,smaller,mortgage,2
loans figures hell debt,loans,figures,hell,debt,2
local giant eagle stores,local,giant,eagle,stores,2
local induction ceremony honor,local,induction,ceremony,honor,2
local portland residents said,local,portland,residents,said,2
locals friendly willing tell,locals,friendly,willing,tell,2
located within important geographic,located,within,important,geographic,2
locations tustin laguna beach,locations,tustin,laguna,beach,2
locker room quiet eventually,locker,room,quiet,eventually,2
locklear rbi beck cook,locklear,rbi,beck,cook,2
lockyer arrived home carrying,lockyer,arrived,home,carrying,2
lofgren dcalif takes two,lofgren,dcalif,takes,two,2
logical chronology details every,logical,chronology,details,every,2
lohse jake westbrook lohse,lohse,jake,westbrook,lohse,2
lohse westbrook entering final,lohse,westbrook,entering,final,2
lone democratic candidate auditor,lone,democratic,candidate,auditor,2
long arms big bodies,long,arms,big,bodies,2
long beach freezes base,long,beach,freezes,base,2
long fish heavy boxes,long,fish,heavy,boxes,2
long since dwight d,long,since,dwight,d,2
long slow getting feels,long,slow,getting,feels,2
long sun keeps shining,long,sun,keeps,shining,2
long time agreed come,long,time,agreed,come,2
longer faster winner raptor,longer,faster,winner,raptor,2
longer remembers disc jockey,longer,remembers,disc,jockey,2
longestserving congressman lost political,longestserving,congressman,lost,political,2
longhandled tongs remove shanks,longhandled,tongs,remove,shanks,4
longtime berkeley watering hole,longtime,berkeley,watering,hole,2
look courics face startling,look,courics,face,startling,2
look like chess pieces,look,like,chess,pieces,3
look really weird donalds,look,really,weird,donalds,3
look video allens home,look,video,allens,home,2
looked injured woman returned,looked,injured,woman,returned,2
looked lovelier acted confidently,looked,lovelier,acted,confidently,2
looked signs improving global,looked,signs,improving,global,2
looking tall funny athletic,looking,tall,funny,athletic,2
looks flavor combinations dovetail,looks,flavor,combinations,dovetail,2
looms shadows slips prolonged,looms,shadows,slips,prolonged,2
lord highlands man car,lord,highlands,man,car,2
lord knows plenty one,lord,knows,plenty,one,2
los angeles th street,los,angeles,th,street,2
lose credit means circle,lose,credit,means,circle,2
loss renewal raw hole,loss,renewal,raw,hole,2
losses greco contends loss,losses,greco,contends,loss,2
lost percent value overdone,lost,percent,value,overdone,2
lost political newcomer matt,lost,political,newcomer,matt,2
lot closer anytime news,lot,closer,anytime,news,2
lot competition one concerned,lot,competition,one,concerned,2
lot filming known th,lot,filming,known,th,2
lot racing left fun,lot,racing,left,fun,2
lotus pair romain grosjean,lotus,pair,romain,grosjean,2
louder new jersey well,louder,new,jersey,well,2
louis architect william b,louis,architect,william,b,2
louis public schools resulted,louis,public,schools,resulted,2
louis university hospital died,louis,university,hospital,died,2
love abbas mamma mia,love,abbas,mamma,mia,2
love always mom dad,love,always,mom,dad,2
love appreciation hold dear,love,appreciation,hold,dear,2
love sing outstanding lot,love,sing,outstanding,lot,2
lovelier acted confidently pictures,lovelier,acted,confidently,pictures,2
low just bury zone,low,just,bury,zone,2
lower bucks hospital bristol,lower,bucks,hospital,bristol,2
lower courts trial companies,lower,courts,trial,companies,2
lower north fork fire,lower,north,fork,fire,2
luck come offensive linemen,luck,come,offensive,linemen,2
lucky plush performs ‚Äú,lucky,plush,performs,‚Äú,2
ludin locklear rbi beck,ludin,locklear,rbi,beck,2
luke much given much,luke,much,given,much,2
lumpsum payouts made company‚ís,lumpsum,payouts,made,company‚ís,2
lungs push heart chest,lungs,push,heart,chest,2
luon grotto dragon pearl,luon,grotto,dragon,pearl,2
lustau east india solera,lustau,east,india,solera,2
lutheran south invitational jefferson,lutheran,south,invitational,jefferson,2
luxury apartment istanbul turkeys,luxury,apartment,istanbul,turkeys,2
lying ground baby girl,lying,ground,baby,girl,3
lynch division income generator,lynch,division,income,generator,2
lynx went regular season,lynx,went,regular,season,2
mabillard inverted coasters built,mabillard,inverted,coasters,built,2
machine even team dragging,machine,even,team,dragging,2
machinegun guards entrance apartment,machinegun,guards,entrance,apartment,2
macron also owes fines,macron,also,owes,fines,2
macron owes nobody buildings,macron,owes,nobody,buildings,2
macys anchor tenant spaces,macys,anchor,tenant,spaces,2
mad crush crowds eardrumpiercing,mad,crush,crowds,eardrumpiercing,2
made can spray paint,made,can,spray,paint,2
made company‚ís pension fund,made,company‚ís,pension,fund,2
made concessions last year,made,concessions,last,year,2
made decision hire ms,made,decision,hire,ms,2
made husband vincente minnelli,made,husband,vincente,minnelli,2
made offers five fourstar,made,offers,five,fourstar,2
made players look like,made,players,look,like,3
made skill technical ability,made,skill,technical,ability,2
made todays hearing aids,made,todays,hearing,aids,2
magic mountain bolliger mabillard,magic,mountain,bolliger,mabillard,2
magnificent beaux arts building,magnificent,beaux,arts,building,3
mail ballots poll ballots,mail,ballots,poll,ballots,3
mail ballots upward arc,mail,ballots,upward,arc,3
mail ballots voters orange,mail,ballots,voters,orange,3
mail fraud involved insurance,mail,fraud,involved,insurance,2
mail went household tasks,mail,went,household,tasks,2
mailorder pharmacies cvs can,mailorder,pharmacies,cvs,can,2
main labor confederations also,main,labor,confederations,also,2
maintain broadcast licenses transmission,maintain,broadcast,licenses,transmission,2
maintaining city operations well,maintaining,city,operations,well,2
major psu hes relied,major,psu,hes,relied,2
majority people attended labor,majority,people,attended,labor,2
majority residents spoke thursday,majority,residents,spoke,thursday,2
make foot pound junior,make,foot,pound,junior,2
make philanthropy focus academics,make,philanthropy,focus,academics,2
make sure we‚Äôre disadvantage,make,sure,we‚Äôre,disadvantage,2
make voluntary contributions appreciation,make,voluntary,contributions,appreciation,2
make whatever color apply,make,whatever,color,apply,2
makes familiar piece fresh,makes,familiar,piece,fresh,2
makes nerve endings millers,makes,nerve,endings,millers,2
making allstar games knicks,making,allstar,games,knicks,2
making difference wants keep,making,difference,wants,keep,2
making first start season,making,first,start,season,2
making six attempts points,making,six,attempts,points,2
mal mixon led group,mal,mixon,led,group,2
