,X1,X2,X3,X4,frequency
kucinichs contention many syria,kucinichs,contention,many,syria,2
kucinichs tuesday meeting political,kucinichs,tuesday,meeting,political,2
kuelap publicly known century,kuelap,publicly,known,century,2
kuelaps isolation long thwarted,kuelaps,isolation,long,thwarted,2
kulygin paul lazar seven,kulygin,paul,lazar,seven,2
kupbens deltas vice president,kupbens,deltas,vice,president,2
kwai fong hotel soho,kwai,fong,hotel,soho,2
la canfora wrote league,la,canfora,wrote,league,2
labeled varietal federal regulations,labeled,varietal,federal,regulations,2
labeled without varietal designation,labeled,without,varietal,designation,2
labor kadima yesh atid,labor,kadima,yesh,atid,2
lack evidence support certain,lack,evidence,support,certain,2
lack popular support poll,lack,popular,support,poll,2
lack track time problem,lack,track,time,problem,2
lacrosse conference victory visiting,lacrosse,conference,victory,visiting,2
lacrosse olivia duncan six,lacrosse,olivia,duncan,six,2
laid four best theyre,laid,four,best,theyre,2
lake oswego friends groups,lake,oswego,friends,groups,2
lake southwestern conference action,lake,southwestern,conference,action,2
lakewood lightweight maybe even,lakewood,lightweight,maybe,even,2
laminate floors never need,laminate,floors,never,need,2
lan kwai fong hotel,lan,kwai,fong,hotel,2
land ohio airline spokesman,land,ohio,airline,spokesman,2
landed dusk hopped onto,landed,dusk,hopped,onto,2
lapses footwork doesnt much,lapses,footwork,doesnt,much,2
laptop‚Äôs webcam stream encounter,laptop‚Äôs,webcam,stream,encounter,2
large arab minority israeli,large,arab,minority,israeli,2
large dog finally got,large,dog,finally,got,2
large dollars twilight year,large,dollars,twilight,year,2
large saucepan prepare bowl,large,saucepan,prepare,bowl,2
largest centerleft parties labor,largest,centerleft,parties,labor,2
largest public companies world,largest,public,companies,world,2
last breaths attacked jackie,last,breaths,attacked,jackie,2
last month didnt believe,last,month,didnt,believe,2
last month included hundreds,last,month,included,hundreds,2
last playoff spin course,last,playoff,spin,course,2
last strength ethan rose,last,strength,ethan,rose,2
last two decades result,last,two,decades,result,2
last week hypocritical say,last,week,hypocritical,say,2
last year added third,last,year,added,third,2
last year five herzog,last,year,five,herzog,2
last year led believe,last,year,led,believe,2
later month baghdad envoys,later,month,baghdad,envoys,2
latest revealed thursday nfl,latest,revealed,thursday,nfl,2
latin america aarp transactions,latin,america,aarp,transactions,2
lauderdale fla since tried,lauderdale,fla,since,tried,2
laugh chuckled tiffany nimmons,laugh,chuckled,tiffany,nimmons,2
launched operation killed osama,launched,operation,killed,osama,2
lautenberg robert menendez dnj,lautenberg,robert,menendez,dnj,2
lavrov said news conference,lavrov,said,news,conference,2
law enforcement orange county,law,enforcement,orange,county,3
law finds congress within,law,finds,congress,within,2
law firm employs son,law,firm,employs,son,2
law requires precincts registered,law,requires,precincts,registered,2
law school campus camden,law,school,campus,camden,2
lawmakers took great pains,lawmakers,took,great,pains,2
lawmakers‚Äô commitment collective bargaining,lawmakers‚Äô,commitment,collective,bargaining,2
lawsuit upends industry already,lawsuit,upends,industry,already,2
lay educational priorities cps,lay,educational,priorities,cps,2
layoffs persistent fears job,layoffs,persistent,fears,job,2
lazar seven years visiting,lazar,seven,years,visiting,2
lead adrian college midwest,lead,adrian,college,midwest,2
lead heart disease stroke,lead,heart,disease,stroke,2
lead negotiations governor final,lead,negotiations,governor,final,2
leaders one year ago,leaders,one,year,ago,2
leaders reorganized staff implemented,leaders,reorganized,staff,implemented,2
leaders state‚Äôs public unions,leaders,state‚Äôs,public,unions,2
leaders turn new leaders,leaders,turn,new,leaders,2
leadership taking top leaders,leadership,taking,top,leaders,2
leading stage riser thinking,leading,stage,riser,thinking,2
leading violator human rights,leading,violator,human,rights,2
leafy greens yao said,leafy,greens,yao,said,2
league rival lutheran north,league,rival,lutheran,north,2
league sources viewing adams,league,sources,viewing,adams,2
leagues movement remove questionable,leagues,movement,remove,questionable,2
leagues worst rushing attack,leagues,worst,rushing,attack,2
learn christopher placed outside,learn,christopher,placed,outside,2
learned madelyn dunham died,learned,madelyn,dunham,died,2
lease vacant district property,lease,vacant,district,property,2
leased planes us navy,leased,planes,us,navy,2
least less important moderate,least,less,important,moderate,2
least million shy coming,least,million,shy,coming,2
least percent given variety,least,percent,given,variety,2
leave taliban remain lack,leave,taliban,remain,lack,2
leaving chips almost impossible,leaving,chips,almost,impossible,2
led believe something bringing,led,believe,something,bringing,2
led move just called,led,move,just,called,2
lee said whenever get,lee,said,whenever,get,2
left behind now personal,left,behind,now,personal,2
left interior home charred,left,interior,home,charred,2
left ritzcarlton now city,left,ritzcarlton,now,city,2
left telecommunications company several,left,telecommunications,company,several,2
left want add affirmations,left,want,add,affirmations,2
legal right marry planned,legal,right,marry,planned,2
legendary ritzcarlton dining room,legendary,ritzcarlton,dining,room,2
legendary tracking passes seemed,legendary,tracking,passes,seemed,2
legislative process expect vote,legislative,process,expect,vote,2
legislators lobbying halls statehouse,legislators,lobbying,halls,statehouse,2
lehi utah interviewed tuesday,lehi,utah,interviewed,tuesday,2
leighton wilmington delbased publicist,leighton,wilmington,delbased,publicist,2
leno first time years,leno,first,time,years,2
lenz said noting cal,lenz,said,noting,cal,2
less charitable appraisal former,less,charitable,appraisal,former,2
less important moderate politics,less,important,moderate,politics,2
lessons start first wednesday,lessons,start,first,wednesday,2
let know end road,let,know,end,road,2
let know skeptical became,let,know,skeptical,became,2
let speedy pivot become,let,speedy,pivot,become,2
lettuce leafy greens yao,lettuce,leafy,greens,yao,2
lettuce salinas farm result,lettuce,salinas,farm,result,2
level club train practice,level,club,train,practice,2
level detail mike bader,level,detail,mike,bader,2
level guys theyre patrol,level,guys,theyre,patrol,2
level system players sides,level,system,players,sides,2
lewis jackson purdue deandre,lewis,jackson,purdue,deandre,2
liability insurance policy information,liability,insurance,policy,information,3
license number liability insurance,license,number,liability,insurance,3
life skills provides hour,life,skills,provides,hour,2
life void filled duncan,life,void,filled,duncan,3
lifting weights practicing throwing,lifting,weights,practicing,throwing,2
liggins kentucky team novak,liggins,kentucky,team,novak,2
light rescue dog weego,light,rescue,dog,weego,2
light though child killed,light,though,child,killed,2
lighter nachos zesty enough,lighter,nachos,zesty,enough,2
lighting ceremony rogge attend,lighting,ceremony,rogge,attend,2
lightweight maybe even bit,lightweight,maybe,even,bit,2
like able education said,like,able,education,said,2
like can musically im,like,can,musically,im,2
like case tyesha hamilton,like,case,tyesha,hamilton,2
like coffin underfoot set,like,coffin,underfoot,set,2
like daryl dixon except,like,daryl,dixon,except,2
like fit well certain,like,fit,well,certain,2
like golf can become,like,golf,can,become,2
like hossa nothing comes,like,hossa,nothing,comes,2
like karen thompson also,like,karen,thompson,also,2
like ok dispatcher tells,like,ok,dispatcher,tells,2
like one tultitlan industrial,like,one,tultitlan,industrial,2
like school important said,like,school,important,said,2
like track character touch,like,track,character,touch,2
like you‚Äôre floating top,like,you‚Äôre,floating,top,2
likeable time little dumb,likeable,time,little,dumb,2
liked thecareerbuildercomad harried office,liked,thecareerbuildercomad,harried,office,2
likely use steroids overthecounter,likely,use,steroids,overthecounter,2
likes mcdonalds amazoncom visa,likes,mcdonalds,amazoncom,visa,2
likes soccer better baseball,likes,soccer,better,baseball,2
line server bagel doughnut,line,server,bagel,doughnut,2
linebacker colin parker recovered,linebacker,colin,parker,recovered,2
lineman mike devito happy,lineman,mike,devito,happy,2
lines cut ‚Äúi‚Äôve long,lines,cut,‚Äúi‚Äôve,long,2
listed city clerks office,listed,city,clerks,office,2
listeria romaine lettuce salinas,listeria,romaine,lettuce,salinas,2
lists one moderately priced,lists,one,moderately,priced,2
liter turbocharged directinjection engine,liter,turbocharged,directinjection,engine,2
little blond girl turns,little,blond,girl,turns,2
little dumb little misguided,little,dumb,little,misguided,2
little hint assad familys,little,hint,assad,familys,2
little hope division scholarship,little,hope,division,scholarship,2
little like coffin underfoot,little,like,coffin,underfoot,2
little misguided fenkart walks,little,misguided,fenkart,walks,2
little terriers neighborhood said,little,terriers,neighborhood,said,2
live music raffles wine,live,music,raffles,wine,2
lived strangers since disappearance,lived,strangers,since,disappearance,2
living honoree husband terry,living,honoree,husband,terry,3
living room area cause,living,room,area,cause,2
llc dc wilson co,llc,dc,wilson,co,2
loaded velvet cantina nachos,loaded,velvet,cantina,nachos,2
lobbying halls statehouse issuing,lobbying,halls,statehouse,issuing,2
lobbyists developers listed city,lobbyists,developers,listed,city,2
lobster ground polenta visited,lobster,ground,polenta,visited,2
local produce showcase salad,local,produce,showcase,salad,2
local prosecutors required overhaul,local,prosecutors,required,overhaul,2
locales royal pedigree ‚Äî,locales,royal,pedigree,‚Äî,2
locations recently said employing,locations,recently,said,employing,2
lockers roy mills sidebyside,lockers,roy,mills,sidebyside,2
logan couture marleau combined,logan,couture,marleau,combined,2
logan tossing heavy bags,logan,tossing,heavy,bags,3
london‚Äîsabmiller plc thursday said,london‚Äîsabmiller,plc,thursday,said,2
long prepared moment still,long,prepared,moment,still,2
long regarded syria regional,long,regarded,syria,regional,2
long thwarted serious research,long,thwarted,serious,research,2
long unable overlook petrinos,long,unable,overlook,petrinos,2
long walk based experience,long,walk,based,experience,2
longer miles shorter flights,longer,miles,shorter,flights,2
longest held record arizona,longest,held,record,arizona,2
longtime highland park residents,longtime,highland,park,residents,2
look conditioning level club,look,conditioning,level,club,2
look rookie virginia tech,look,rookie,virginia,tech,2
looked ahead giants series,looked,ahead,giants,series,2
looked said ‚Äòaah mom,looked,said,‚Äòaah,mom,2
looked vigorous suffered massive,looked,vigorous,suffered,massive,2
looking forward lack track,looking,forward,lack,track,2
looking matchup center faceoff,looking,matchup,center,faceoff,2
looks forward firstrounder quinton,looks,forward,firstrounder,quinton,2
looks little like coffin,looks,little,like,coffin,2
loop destination thats virtual,loop,destination,thats,virtual,2
loophole childs noveggie policy,loophole,childs,noveggie,policy,2
looters curious carted bones,looters,curious,carted,bones,2
lordstown allowing effectively run,lordstown,allowing,effectively,run,2
lorri galloway said spoken,lorri,galloway,said,spoken,2
los altos de anza,los,altos,de,anza,2
los angeles begins monday,los,angeles,begins,monday,2
los gatos wilcox santa,los,gatos,wilcox,santa,2
lose denier said david,lose,denier,said,david,2
lose player like hossa,lose,player,like,hossa,2
losing dropping record season,losing,dropping,record,season,2
losing winger michael ryder,losing,winger,michael,ryder,2
loss avon lake southwestern,loss,avon,lake,southwestern,2
loss profits canceling preseason,loss,profits,canceling,preseason,2
lost step theyre different,lost,step,theyre,different,2
lot chips mention tell,lot,chips,mention,tell,2
lot groins lot lower,lot,groins,lot,lower,2
lot hip flexors types,lot,hip,flexors,types,2
lot interest reducing use,lot,interest,reducing,use,2
lot lower back injuries,lot,lower,back,injuries,2
lot opportunity critical situations,lot,opportunity,critical,situations,2
lot people‚Äù clark said,lot,people‚Äù,clark,said,2
lot players dont want,lot,players,dont,want,2
lot softtissue type injuries,lot,softtissue,type,injuries,2
lot time big supermarket,lot,time,big,supermarket,2
lots good cutdowns camera,lots,good,cutdowns,camera,2
lou piccola took heat,lou,piccola,took,heat,2
louis blues ownership saying,louis,blues,ownership,saying,2
louis county united way,louis,county,united,way,2
louis delmas gosder cherilus,louis,delmas,gosder,cherilus,2
louis jackson county contains,louis,jackson,county,contains,2
louis plans works open,louis,plans,works,open,2
louis public schools students,louis,public,schools,students,2
love fact college students,love,fact,college,students,2
love journalism working college,love,journalism,working,college,2
love theyre fresh colorful,love,theyre,fresh,colorful,2
loves think shane ever,loves,think,shane,ever,2
lower back injuries lot,lower,back,injuries,lot,2
lowered peterson‚Äôs bail posted,lowered,peterson‚Äôs,bail,posted,2
lowest level since october,lowest,level,since,october,2
loyalty damaged stagnant wages,loyalty,damaged,stagnant,wages,2
lpga commissioner michael whan,lpga,commissioner,michael,whan,2
lube clackamas federal credit,lube,clackamas,federal,credit,2
luck much hubris thought,luck,much,hubris,thought,2
luke mills wrote last,luke,mills,wrote,last,2
lump sum federal money,lump,sum,federal,money,2
lunch mondaysunday brunch saturdaysunday,lunch,mondaysunday,brunch,saturdaysunday,2
luncheon april th disneyland,luncheon,april,th,disneyland,3
lutheran north trinity jennings,lutheran,north,trinity,jennings,2
lying investigators earlier year,lying,investigators,earlier,year,2
lynbrook tangles saratoga palo,lynbrook,tangles,saratoga,palo,2
lyra belacqua return planned,lyra,belacqua,return,planned,2
m v reservations strongly,m,v,reservations,strongly,2
machu picchu became international,machu,picchu,became,international,2
made big bet almost,made,big,bet,almost,2
made lobster ground polenta,made,lobster,ground,polenta,2
made million math minutes,made,million,math,minutes,2
made mistake draft stock,made,mistake,draft,stock,2
made percent shots postseason,made,percent,shots,postseason,2
made point now get,made,point,now,get,2
made soughtafter speaker last,made,soughtafter,speaker,last,2
madelyn dunham died long,madelyn,dunham,died,long,2
magazine editors emerson stood,magazine,editors,emerson,stood,2
magazines whatever many us,magazines,whatever,many,us,2
magnificat high school spent,magnificat,high,school,spent,2
mahmoud may called testify,mahmoud,may,called,testify,2
mahmoud told phone conference,mahmoud,told,phone,conference,2
mail yet still felt,mail,yet,still,felt,2
mailbox junk mail yet,mailbox,junk,mail,yet,2
main classroom building auditorium,main,classroom,building,auditorium,2
main concourse miniature reimagined,main,concourse,miniature,reimagined,2
main floor well bit,main,floor,well,bit,2
mainly freight trains stopping,mainly,freight,trains,stopping,2
major donors restore future,major,donors,restore,future,2
majority signup provision final,majority,signup,provision,final,2
make best can ask,make,best,can,ask,2
make deliciously green vegetarian,make,deliciously,green,vegetarian,2
make feel like you‚Äôre,make,feel,like,you‚Äôre,2
make great greasy alcoholsopping,make,great,greasy,alcoholsopping,2
make progress complying settlement,make,progress,complying,settlement,2
make project appeals lot,make,project,appeals,lot,2
make reservations calling winterthur,make,reservations,calling,winterthur,3
make special side dish,make,special,side,dish,2
make stock ask chef,make,stock,ask,chef,2
make sure can get,make,sure,can,get,2
make sure frame cast,make,sure,frame,cast,2
make sure movie meets,make,sure,movie,meets,2
make sure stayed lee,make,sure,stayed,lee,2
make sure typical endoflife,make,sure,typical,endoflife,2
make terror return village,make,terror,return,village,2
maker audience inc priced,maker,audience,inc,priced,2
makers suspense drama hours,makers,suspense,drama,hours,2
makes flatrolled steel treating,makes,flatrolled,steel,treating,2
making happen event chair,making,happen,event,chair,3
making positive impact world‚Äù,making,positive,impact,world‚Äù,2
making push coach tom,making,push,coach,tom,2
making unilateral demands government,making,unilateral,demands,government,2
malaj said district officials,malaj,said,district,officials,2
maloof ‚Äú personally reminded,maloof,‚Äú,personally,reminded,2
man cited disorderly conduct,man,cited,disorderly,conduct,2
man merle dixon portrayed,man,merle,dixon,portrayed,2
man sweat decorously smudged,man,sweat,decorously,smudged,3
man woman young old,man,woman,young,old,2
management courses clean urine,management,courses,clean,urine,2
manager joseph gall city,manager,joseph,gall,city,2
manager midsized business operation,manager,midsized,business,operation,2
manager tony la russa,manager,tony,la,russa,2
managing director pwcs entertainment,managing,director,pwcs,entertainment,2
managing unique ecosystem covers,managing,unique,ecosystem,covers,2
maneuvering kind washington nuance,maneuvering,kind,washington,nuance,2
mantra curling olympic sport,mantra,curling,olympic,sport,2
many exciting wines enter,many,exciting,wines,enter,2
many messages reading occupy,many,messages,reading,occupy,2
many people minaj said,many,people,minaj,said,2
many percent people take,many,percent,people,take,2
many reform measures promoted,many,reform,measures,promoted,2
many syria want assad,many,syria,want,assad,2
many times people written,many,times,people,written,2
many us take granted,many,us,take,granted,2
maraj resorted timehonored tactic,maraj,resorted,timehonored,tactic,2
march headed toward unrestricted,march,headed,toward,unrestricted,2
march included san franciscobased,march,included,san,franciscobased,2
march issue vogue drew,march,issue,vogue,drew,2
march st louis jackson,march,st,louis,jackson,2
marchers included people ages,marchers,included,people,ages,2
marian gaborik recovering hip,marian,gaborik,recovering,hip,2
maricopa county attorney rick,maricopa,county,attorney,rick,2
marijuana nfl combine february,marijuana,nfl,combine,february,2
marinara sexy interior one,marinara,sexy,interior,one,2
mario castellanos executive director,mario,castellanos,executive,director,2
mark k matthews orlando,mark,k,matthews,orlando,2
market cant tell many,market,cant,tell,many,2
market days blends labeled,market,days,blends,labeled,2
market value injuryplagued bruins,market,value,injuryplagued,bruins,2
markets continuing drive growth,markets,continuing,drive,growth,2
markets settling jan growing,markets,settling,jan,growing,2
marleau combined score just,marleau,combined,score,just,2
marriage continues undiminished signal,marriage,continues,undiminished,signal,2
marriage president obama said,marriage,president,obama,said,2
marriage sunday morning talk,marriage,sunday,morning,talk,2
married older kulygin paul,married,older,kulygin,paul,2
marry planned say convention,marry,planned,say,convention,2
martinez line server bagel,martinez,line,server,bagel,2
martinez says changes save,martinez,says,changes,save,2
marvelstyle myth even make,marvelstyle,myth,even,make,2
marylanders show kate jolly,marylanders,show,kate,jolly,2
masha shes married older,masha,shes,married,older,2
masks land ohio airline,masks,land,ohio,airline,2
mass discovered love journalism,mass,discovered,love,journalism,2
mass layoffs persistent fears,mass,layoffs,persistent,fears,2
matakas said he‚íd hoped,matakas,said,he‚íd,hoped,2
matchup center faceoff specialist,matchup,center,faceoff,specialist,2
math minutes twodisc version,math,minutes,twodisc,version,2
math sections state test,math,sections,state,test,2
matter breading wasnt tasty,matter,breading,wasnt,tasty,2
matter demand applications surge,matter,demand,applications,surge,2
matter motorcycles getting noticed,matter,motorcycles,getting,noticed,2
matthews spokesman national aclu,matthews,spokesman,national,aclu,2
maximum penalties fine possible,maximum,penalties,fine,possible,2
may agreement local prosecutors,may,agreement,local,prosecutors,2
may brookline mass discovered,may,brookline,mass,discovered,2
may called testify wire,may,called,testify,wire,2
may frustrate type personality,may,frustrate,type,personality,2
may likely use steroids,may,likely,use,steroids,2
may prejudice people continually,may,prejudice,people,continually,2
maybe even bit political,maybe,even,bit,political,2
maybe look conditioning level,maybe,look,conditioning,level,2
mayor glenn d cunningham,mayor,glenn,d,cunningham,2
mc born onika maraj,mc,born,onika,maraj,2
mcbride predicts continued decline,mcbride,predicts,continued,decline,2
mcclendon said deeply sorry,mcclendon,said,deeply,sorry,2
mccluer southberkeley lutheran north,mccluer,southberkeley,lutheran,north,2
mcdonald blues let speedy,mcdonald,blues,let,speedy,2
mcdonalds amazoncom visa journal,mcdonalds,amazoncom,visa,journal,2
mcdonough remembered one walters,mcdonough,remembered,one,walters,2
mci left telecommunications company,mci,left,telecommunications,company,2
mcquaidand former vcoc board,mcquaidand,former,vcoc,board,3
meadows attempted murder assault,meadows,attempted,murder,assault,2
mean growing media moss,mean,growing,media,moss,2
mean industry given carte,mean,industry,given,carte,2
mean wont mcbride predicts,mean,wont,mcbride,predicts,2
means cavaliers earned victories,means,cavaliers,earned,victories,2
means chief financial officer,means,chief,financial,officer,2
means fewer go around,means,fewer,go,around,2
means former ohio state,means,former,ohio,state,2
meant operating complex computer,meant,operating,complex,computer,2
meanwhile city honored lake,meanwhile,city,honored,lake,2
meanwhile sharks three goal,meanwhile,sharks,three,goal,2
measures promoted emanuel campaign,measures,promoted,emanuel,campaign,2
mechanical inspections reinspections performed,mechanical,inspections,reinspections,performed,2
medalists brian goodell tom,medalists,brian,goodell,tom,2
media close government indicated,media,close,government,indicated,2
media moss bark chips,media,moss,bark,chips,2
medical decisions withholding food,medical,decisions,withholding,food,2
medium heat add garlic,medium,heat,add,garlic,2
meds schizophrenia drugs side,meds,schizophrenia,drugs,side,2
meet lynbrook tangles saratoga,meet,lynbrook,tangles,saratoga,2
meet president barack obama,meet,president,barack,obama,3
meet tomorrow rutgers law,meet,tomorrow,rutgers,law,2
meeting emerged soaking sweat,meeting,emerged,soaking,sweat,2
meeting june refusing respond,meeting,june,refusing,respond,2
meeting political opposition members,meeting,political,opposition,members,2
meeting solve nations unemployment,meeting,solve,nations,unemployment,2
meeting take place csus,meeting,take,place,csus,2
meetings kiley cook various,meetings,kiley,cook,various,2
meets expectations also accessible,meets,expectations,also,accessible,2
megawatts seen first step,megawatts,seen,first,step,2
mellow goat cheese cherry,mellow,goat,cheese,cherry,2
member afghan special forces,member,afghan,special,forces,2
member county engineers office,member,county,engineers,office,2
members congressional black caucus,members,congressional,black,caucus,3
members national trust historic,members,national,trust,historic,3
members paid admission phoenix,members,paid,admission,phoenix,2
members reach legislators lobbying,members,reach,legislators,lobbying,2
members supported kucinichs contention,members,supported,kucinichs,contention,2
men monday evening saying,men,monday,evening,saying,2
men texas saying stab,men,texas,saying,stab,2
menendez dnj reached deal,menendez,dnj,reached,deal,2
mention locales royal pedigree,mention,locales,royal,pedigree,2
mention tell thought noticed,mention,tell,thought,noticed,2
menu information sourcing might,menu,information,sourcing,might,2
menza said officers laid,menza,said,officers,laid,2
mercy shown done everything,mercy,shown,done,everything,3
merest hint garlic individual,merest,hint,garlic,individual,2
merle dixon portrayed michael,merle,dixon,portrayed,michael,2
merry old england even,merry,old,england,even,2
mess resulted previous administration,mess,resulted,previous,administration,2
message canadian values core,message,canadian,values,core,2
message never delivered can,message,never,delivered,can,2
message newburgh heights clerktreasurer,message,newburgh,heights,clerktreasurer,2
messages reading occupy barricade,messages,reading,occupy,barricade,2
metabolic syndrome cluster symptoms,metabolic,syndrome,cluster,symptoms,2
methods can help prevent,methods,can,help,prevent,2
metro league rival lutheran,metro,league,rival,lutheran,2
mexico us oil postulates,mexico,us,oil,postulates,2
meyer uses determine player,meyer,uses,determine,player,2
