,X1,X2,X3,X4,frequency
ñ sts p row,ñ,sts,p,row,6
ím pretty sure ís,ím,pretty,sure,ís,4
ím really looking forward,ím,really,looking,forward,10
íve spent lot time,íve,spent,lot,time,4
ì î subject change,ì,î,subject,change,20
î gannett lecture series,î,gannett,lecture,series,4
î subject change removal,î,subject,change,removal,20
add eggs one time,add,eggs,one,time,9
advertising fees advertising linking,advertising,fees,advertising,linking,20
advertising linking amazoncom amazonca,advertising,linking,amazoncom,amazonca,20
allpowerful god like î,allpowerful,god,like,î,4
amazon eu associates programmes,amazon,eu,associates,programmes,20
amazon eu content provided,amazon,eu,content,provided,20
amazon services llc amazon,amazon,services,llc,amazon,20
amazon services llc andor,amazon,services,llc,andor,20
amazonca amazoncouk amazonde amazonfr,amazonca,amazoncouk,amazonde,amazonfr,20
amazoncom amazonca amazoncouk amazonde,amazoncom,amazonca,amazoncouk,amazonde,20
amazoncouk amazonde amazonfr amazonit,amazoncouk,amazonde,amazonfr,amazonit,20
amazonde amazonfr amazonit amazones,amazonde,amazonfr,amazonit,amazones,20
amazones certain content appears,amazones,certain,content,appears,20
amazonfr amazonit amazones certain,amazonfr,amazonit,amazones,certain,20
amazonit amazones certain content,amazonit,amazones,certain,content,20
andor amazon eu content,andor,amazon,eu,content,20
appears website comes amazon,appears,website,comes,amazon,20
archives libraries museums historical,archives,libraries,museums,historical,4
ask huge allpowerful god,ask,huge,allpowerful,god,4
associates programmes designed provide,associates,programmes,designed,provide,20
available merchantís website see,available,merchantís,website,see,4
ay ay ay ay,ay,ay,ay,ay,4
bake degrees f minutes,bake,degrees,f,minutes,4
baking powder baking soda,baking,powder,baking,soda,6
baking soda baking powder,baking,soda,baking,powder,5
beginning word word god,beginning,word,word,god,4
better late never right,better,late,never,right,4
betty macdonald fan club,betty,macdonald,fan,club,4
billion trailing twelve months,billion,trailing,twelve,months,8
c item b pp,c,item,b,pp,8
can also deliver nuclear,can,also,deliver,nuclear,4
can count one hand,can,count,one,hand,5
cant remember last time,cant,remember,last,time,4
capitalism supreme flavor spirit,capitalism,supreme,flavor,spirit,6
caprera hotel venice italy,caprera,hotel,venice,italy,5
carl schumann porcelain factory,carl,schumann,porcelain,factory,4
certain content appears website,certain,content,appears,website,20
chicago chicago illinois incorporated,chicago,chicago,illinois,incorporated,10
chicago illinois incorporated item,chicago,illinois,incorporated,item,19
christmas happy new year,christmas,happy,new,year,5
christmas season happy new,christmas,season,happy,new,5
city kansas news station,city,kansas,news,station,8
comes amazon services llc,comes,amazon,services,llc,20
compared billion trailing twelve,compared,billion,trailing,twelve,4
computer science graduate program,computer,science,graduate,program,5
constitution î gannett lecture,constitution,î,gannett,lecture,4
content appears website comes,content,appears,website,comes,20
content provided ì î,content,provided,ì,î,20
conway south carolina florists,conway,south,carolina,florists,13
cost damage attacks enemies,cost,damage,attacks,enemies,7
council member letitia james,council,member,letitia,james,6
court justice european union,court,justice,european,union,4
cover plastic wrap refrigerate,cover,plastic,wrap,refrigerate,5
cyclists want accountability drivers,cyclists,want,accountability,drivers,4
damage attacks enemies times,damage,attacks,enemies,times,6
day see im really,day,see,im,really,4
day took opportunity go,day,took,opportunity,go,4
dear heavenly father thank,dear,heavenly,father,thank,4
dec sc sc dec,dec,sc,sc,dec,4
dec st side next,dec,st,side,next,4
designed provide means sites,designed,provide,means,sites,20
donít get wrong love,donít,get,wrong,love,5
dont even get started,dont,even,get,started,6
dont forget enter giveaway,dont,forget,enter,giveaway,4
dont think ive ever,dont,think,ive,ever,4
e e e e,e,e,e,e,9
earn advertising fees advertising,earn,advertising,fees,advertising,20
ebook can view windows,ebook,can,view,windows,4
egalitarian highest form democracy,egalitarian,highest,form,democracy,5
eggs one time beating,eggs,one,time,beating,7
enter many times like,enter,many,times,like,4
eu associates programmes designed,eu,associates,programmes,designed,20
eu content provided ì,eu,content,provided,ì,20
fannie mae freddie mac,fannie,mae,freddie,mac,4
father lord jesus christ,father,lord,jesus,christ,6
feel free add comments,feel,free,add,comments,4
fees advertising linking amazoncom,fees,advertising,linking,amazoncom,20
fell th iris bleu,fell,th,iris,bleu,4
firing system mechanical firing,firing,system,mechanical,firing,4
flavor spirit egalitarian highest,flavor,spirit,egalitarian,highest,5
flour baking soda salt,flour,baking,soda,salt,4
form capitalism supreme flavor,form,capitalism,supreme,flavor,6
freshly ground black pepper,freshly,ground,black,pepper,7
gaming industry makes money,gaming,industry,makes,money,4
gannett lecture series rochester,gannett,lecture,series,rochester,4
gauge sts rows î,gauge,sts,rows,î,4
glory christ jesus amen,glory,christ,jesus,amen,4
god father lord jesus,god,father,lord,jesus,6
grand theater bismarck north,grand,theater,bismarck,north,5
greek star chicago illinois,greek,star,chicago,illinois,6
halton district school board,halton,district,school,board,4
happy new year everyone,happy,new,year,everyone,5
hermes birkin imitation totes,hermes,birkin,imitation,totes,4
highest form capitalism supreme,highest,form,capitalism,supreme,6
hope wonderful christmas season,hope,wonderful,christmas,season,5
house speaker john boehner,house,speaker,john,boehner,5
huge allpowerful god like,huge,allpowerful,god,like,4
illinois incorporated item c,illinois,incorporated,item,c,20
im always looking new,im,always,looking,new,4
im really looking forward,im,really,looking,forward,6
im really sure theres,im,really,sure,theres,4
im sure youve heard,im,sure,youve,heard,5
incorporated item b pp,incorporated,item,b,pp,6
incorporated item c item,incorporated,item,c,item,8
incorporated item c pp,incorporated,item,c,pp,21
infect control hosp epidemiol,infect,control,hosp,epidemiol,4
inserted center comes clean,inserted,center,comes,clean,4
institute technology rochester new,institute,technology,rochester,new,4
intellectual property law practice,intellectual,property,law,practice,5
item b projected pp,item,b,projected,pp,4
item c item b,item,c,item,b,8
item c pp item,item,c,pp,item,4
j occup environ med,j,occup,environ,med,4
john smithís grand national,john,smithís,grand,national,18
journal intellectual property law,journal,intellectual,property,law,5
just like everyone else,just,like,everyone,else,4
just want whats surface,just,want,whats,surface,4
k row p row,k,row,p,row,4
kansas news station television,kansas,news,station,television,8
late better late never,late,better,late,never,4
late s early s,late,s,early,s,7
law loyola university chicago,law,loyola,university,chicago,5
leave comment let know,leave,comment,let,know,5
lecture series rochester institute,lecture,series,rochester,institute,4
les filles de mardi,les,filles,de,mardi,4
let imaginations run wild,let,imaginations,run,wild,4
let us know think,let,us,know,think,4
level mp cost damage,level,mp,cost,damage,10
level mp cost duration,level,mp,cost,duration,13
libraries museums historical societies,libraries,museums,historical,societies,4
lightly oiled bowl cover,lightly,oiled,bowl,cover,4
like wish everyone happy,like,wish,everyone,happy,4
linking amazoncom amazonca amazoncouk,linking,amazoncom,amazonca,amazoncouk,20
little goes long way,little,goes,long,way,6
little red riding hood,little,red,riding,hood,6
llc amazon eu associates,llc,amazon,eu,associates,20
llc andor amazon eu,llc,andor,amazon,eu,20
loyola university chicago chicago,loyola,university,chicago,chicago,6
made flesh dwelt among,made,flesh,dwelt,among,4
make world better place,make,world,better,place,5
may th pm central,may,th,pm,central,4
means sites earn advertising,means,sites,earn,advertising,20
merry christmas happy new,merry,christmas,happy,new,5
middle east media sampler,middle,east,media,sampler,5
minutes add garlic cook,minutes,add,garlic,cook,4
minutes remove cake oven,minutes,remove,cake,oven,4
months compared billion trailing,months,compared,billion,trailing,4
mp cost damage attacks,mp,cost,damage,attacks,7
mp cost duration seconds,mp,cost,duration,seconds,13
never seen anything like,never,seen,anything,like,5
new york incorporated item,new,york,incorporated,item,4
next row ñ sts,next,row,ñ,sts,6
next row inc st,next,row,inc,st,4
olive oil salt pepper,olive,oil,salt,pepper,6
one day see im,one,day,see,im,4
one thing sure though,one,thing,sure,though,4
one time beating well,one,time,beating,well,4
online gallery please use,online,gallery,please,use,4
open highest form capitalism,open,highest,form,capitalism,6
p row dec st,p,row,dec,st,4
participant amazon services llc,participant,amazon,services,llc,20
plastic wrap refrigerate least,plastic,wrap,refrigerate,least,4
please let know can,please,let,know,can,4
please use direct link,please,use,direct,link,4
preheat oven degrees f,preheat,oven,degrees,f,9
preheat oven degrees grease,preheat,oven,degrees,grease,4
prime minister david cameron,prime,minister,david,cameron,4
programmes designed provide means,programmes,designed,provide,means,20
property law practice doi,property,law,practice,doi,4
provide means sites earn,provide,means,sites,earn,20
provided ì î subject,provided,ì,î,subject,20
radio city music hall,radio,city,music,hall,4
really looking forward seeing,really,looking,forward,seeing,4
really sure theres lot,really,sure,theres,lot,4
reciprocal relations uninterrupted open,reciprocal,relations,uninterrupted,open,4
relations uninterrupted open highest,relations,uninterrupted,open,highest,4
relativistic quantum field theories,relativistic,quantum,field,theories,4
renault clio engine management,renault,clio,engine,management,6
rochester institute technology rochester,rochester,institute,technology,rochester,4
rochester new york incorporated,rochester,new,york,incorporated,4
row ñ sts p,row,ñ,sts,p,4
row ch turn sc,row,ch,turn,sc,7
row dec st side,row,dec,st,side,4
rows î stockinette stitch,rows,î,stockinette,stitch,4
runs avg s high,runs,avg,s,high,4
salt freshly ground black,salt,freshly,ground,black,4
santelena hotel venice italy,santelena,hotel,venice,italy,9
sc dec sc sc,sc,dec,sc,sc,4
school law loyola university,school,law,loyola,university,5
science graduate program rankings,science,graduate,program,rankings,5
season happy new year,season,happy,new,year,5
see im really sure,see,im,really,sure,4
see light end tunnel,see,light,end,tunnel,4
series rochester institute technology,series,rochester,institute,technology,4
services llc amazon eu,services,llc,amazon,eu,20
services llc andor amazon,services,llc,andor,amazon,20
side next row ñ,side,next,row,ñ,6
sites earn advertising fees,sites,earn,advertising,fees,20
smithís grand national record,smithís,grand,national,record,7
south carolina county history,south,carolina,county,history,12
south carolina wedding announcements,south,carolina,wedding,announcements,4
spent time good friends,spent,time,good,friends,4
spirit egalitarian highest form,spirit,egalitarian,highest,form,5
st side next row,st,side,next,row,6
sts k row p,sts,k,row,p,4
sts p row k,sts,p,row,k,4
sts rows î stockinette,sts,rows,î,stockinette,4
students create comic strips,students,create,comic,strips,4
subject change removal time,subject,change,removal,time,20
supreme flavor spirit egalitarian,supreme,flavor,spirit,egalitarian,6
surface theres nothing underneath,surface,theres,nothing,underneath,4
system mechanical firing system,system,mechanical,firing,system,4
technology rochester new york,technology,rochester,new,york,4
ten years ago went,ten,years,ago,went,4
theater bismarck north dakota,theater,bismarck,north,dakota,5
throughout boundaries subregional nationstate,throughout,boundaries,subregional,nationstate,4
time beating well addition,time,beating,well,addition,4
together flour baking powder,together,flour,baking,powder,4
trailing twelve months compared,trailing,twelve,months,compared,4
trailing twelve months ended,trailing,twelve,months,ended,4
twelve months compared billion,twelve,months,compared,billion,4
twelve months ended march,twelve,months,ended,march,4
uninterrupted open highest form,uninterrupted,open,highest,form,6
university chicago chicago illinois,university,chicago,chicago,illinois,13
use daily bread designs,use,daily,bread,designs,4
want whats surface theres,want,whats,surface,theres,4
website comes amazon services,website,comes,amazon,services,20
whats surface theres nothing,whats,surface,theres,nothing,4
williston north dakota rentals,williston,north,dakota,rentals,4
wire rack cool completely,wire,rack,cool,completely,4
wonderful christmas season happy,wonderful,christmas,season,happy,5
word made flesh dwelt,word,made,flesh,dwelt,4
world press freedom day,world,press,freedom,day,4
york incorporated item c,york,incorporated,item,c,4
‚ñ particularly selections bob,‚ñ,particularly,selections,bob,2
„∏ cant sure without,„∏,cant,sure,without,2
„∏ hopkins said chad,„∏,hopkins,said,chad,2
‚ì put us like,‚ì,put,us,like,2
‚Äò‚Äò course hes outstanding,‚Äò‚Äò,course,hes,outstanding,2
‚Äò‚Äòhes good football player,‚Äò‚Äòhes,good,football,player,2
‚Äòthats badge courage went,‚Äòthats,badge,courage,went,2
‚Äì career ‚Äì win,‚Äì,career,‚Äì,win,2
‚Äì hoffman s feeko,‚Äì,hoffman,s,feeko,2
‚Äì shenasi dey pabich,‚Äì,shenasi,dey,pabich,2
‚Äì typical stock lost,‚Äì,typical,stock,lost,2
‚Äì win lutheran south,‚Äì,win,lutheran,south,2
‚Äî buffington fort collins,‚Äî,buffington,fort,collins,2
‚Äî called tdap ‚Äî,‚Äî,called,tdap,‚Äî,2
‚Äî cheyenne mountain wheat,‚Äî,cheyenne,mountain,wheat,2
‚Äî continued stellar performance,‚Äî,continued,stellar,performance,2
‚Äî depends contact infant,‚Äî,depends,contact,infant,2
‚Äî last national league,‚Äî,last,national,league,2
‚Äî lieu simple td,‚Äî,lieu,simple,td,2
‚Äî ok maybe now,‚Äî,ok,maybe,now,2
‚Äî people like vaughan,‚Äî,people,like,vaughan,2
‚Äî place loss renewal,‚Äî,place,loss,renewal,2
‚Äî quite fortuitous putka‚Äôs,‚Äî,quite,fortuitous,putka‚Äôs,2
‚Äî rutgers university says,‚Äî,rutgers,university,says,3
‚Äî sleeping redskins pulled,‚Äî,sleeping,redskins,pulled,2
‚Äî states largest teachers,‚Äî,states,largest,teachers,2
‚Äî steal rest nfl,‚Äî,steal,rest,nfl,2
‚Äî sweet doeeyed little,‚Äî,sweet,doeeyed,little,2
‚Äî sympathetic ‚Äî witness,‚Äî,sympathetic,‚Äî,witness,2
‚Äî township girl scout,‚Äî,township,girl,scout,2
‚Äî witness away spotlight,‚Äî,witness,away,spotlight,2
‚Äîespecially holmgren ‚Äî sleeping,‚Äîespecially,holmgren,‚Äî,sleeping,2
‚Ä¢ average wage workers,‚Ä¢,average,wage,workers,2
‚Ä¢ shooting woes continue,‚Ä¢,shooting,woes,continue,2
‚Äù league commissioner bernadette,‚Äù,league,commissioner,bernadette,2
‚Äú decision accept butler,‚Äú,decision,accept,butler,2
‚Äú guys fearless really,‚Äú,guys,fearless,really,2
‚Äú just don‚Äôt like,‚Äú,just,don‚Äôt,like,2
‚Äú next culprit school,‚Äú,next,culprit,school,2
‚Äú presence rookie thus,‚Äú,presence,rookie,thus,2
‚Äú road put back,‚Äú,road,put,back,2
‚Äú think whole idea,‚Äú,think,whole,idea,2
‚Äú took really good,‚Äú,took,really,good,2
‚Äú truly privilege honor,‚Äú,truly,privilege,honor,2
‚Äú wanted something healthy,‚Äú,wanted,something,healthy,2
‚Äú wonder property taxes,‚Äú,wonder,property,taxes,2
‚Äúeveryone consider registering organ,‚Äúeveryone,consider,registering,organ,2
‚Äúsurprised me‚Äù valentine said,‚Äúsurprised,me‚Äù,valentine,said,2
‚Äúthings didn‚Äôt always go,‚Äúthings,didn‚Äôt,always,go,2
abandoned fbi unreliability cannons,abandoned,fbi,unreliability,cannons,2
abbas mamma mia fox,abbas,mamma,mia,fox,2
abc young people met,abc,young,people,met,2
ability pick prescriptions namesake,ability,pick,prescriptions,namesake,2
ability rock back xavier,ability,rock,back,xavier,2
able blues blues teams,able,blues,blues,teams,2
able confirm report james,able,confirm,report,james,2
able tell upfront exact,able,tell,upfront,exact,2
abortions since landmark roe,abortions,since,landmark,roe,2
aboveaverage death rates following,aboveaverage,death,rates,following,2
abusive toward mom things,abusive,toward,mom,things,2
academic studies reached different,academic,studies,reached,different,2
academically struggling elementary campuses,academically,struggling,elementary,campuses,2
academics student life winner,academics,student,life,winner,2
academy downed oviedo semifinal,academy,downed,oviedo,semifinal,2
accept butler easy one,accept,butler,easy,one,2
accept shoes weekdays county‚Äôs,accept,shoes,weekdays,county‚Äôs,2
accepted difficult street parking,accepted,difficult,street,parking,3
access jerusalem west bank,access,jerusalem,west,bank,2
accessorized old letterpress trays,accessorized,old,letterpress,trays,2
accomplish something interest country,accomplish,something,interest,country,2
according essex county sheriff‚Äôs,according,essex,county,sheriff‚Äôs,2
according nfl fujita pledged,according,nfl,fujita,pledged,2
according rivals oregon made,according,rivals,oregon,made,2
according shareholder activist group,according,shareholder,activist,group,2
according testimony dr tony,according,testimony,dr,tony,3
according wnet president neal,according,wnet,president,neal,2
account saying it‚Äôs just,account,saying,it‚Äôs,just,2
accounted half bofa‚Äôs originations,accounted,half,bofa‚Äôs,originations,2
accused mediapart forgery publication,accused,mediapart,forgery,publication,2
achievement carolyn cotta youth,achievement,carolyn,cotta,youth,2
achievement obviously trouble blaming,achievement,obviously,trouble,blaming,2
aching health now issue,aching,health,now,issue,2
acidic reasons pretty nonprophet,acidic,reasons,pretty,nonprophet,2
acknowledgement way old mad,acknowledgement,way,old,mad,2
acquire howard even body,acquire,howard,even,body,2
acquisition power forward david,acquisition,power,forward,david,2
acres woods officers found,acres,woods,officers,found,3
across city built turn,across,city,built,turn,2
across country already canceled,across,country,already,canceled,2
across country recruiting season,across,country,recruiting,season,2
across country song nyucknyucknyucked,across,country,song,nyucknyucknyucked,2
act next month museum,act,next,month,museum,2
acted confidently pictures made,acted,confidently,pictures,made,2
acted like prove something,acted,like,prove,something,2
acting education commissioner bret,acting,education,commissioner,bret,3
active marketing mail ballots,active,marketing,mail,ballots,3
active role exgovernor fall,active,role,exgovernor,fall,2
activist group sow study,activist,group,sow,study,2
activities kids including sports,activities,kids,including,sports,2
activities like soccer basketball,activities,like,soccer,basketball,2
actor kevin bacon brought,actor,kevin,bacon,brought,2
acts classic rock era,acts,classic,rock,era,2
actually set stage great,actually,set,stage,great,2
adam wainwright jaime garcia,adam,wainwright,jaime,garcia,2
adams breedlove agree likely,adams,breedlove,agree,likely,2
adams town week report,adams,town,week,report,2
add ability pick prescriptions,add,ability,pick,prescriptions,2
add apples stirring coat,add,apples,stirring,coat,2
add avocados carrots farro,add,avocados,carrots,farro,2
add dressing desired season,add,dressing,desired,season,2
add half dressing taste,add,half,dressing,taste,2
add new jobs branches,add,new,jobs,branches,2
add payrolls central bank,add,payrolls,central,bank,2
add promptly filed perjury,add,promptly,filed,perjury,2
added high danger developing,added,high,danger,developing,2
adding shock color makes,adding,shock,color,makes,2
addition million year new,addition,million,year,new,2
additional goal nice picked,additional,goal,nice,picked,2
additionally like project based,additionally,like,project,based,2
address issue obesity‚Äù shields,address,issue,obesity‚Äù,shields,2
address mistakenly listed morrison,address,mistakenly,listed,morrison,2
adjustment meeting last month,adjustment,meeting,last,month,2
administer drug benefits employers,administer,drug,benefits,employers,2
administrator cfo advised increase,administrator,cfo,advised,increase,2
admission may first len,admission,may,first,len,3
admitted husband relying commitment,admitted,husband,relying,commitment,2
admitting easier said done,admitting,easier,said,done,2
adored one although brief,adored,one,although,brief,2
advanced face fort lauderdale,advanced,face,fort,lauderdale,2
advanced version blues im,advanced,version,blues,im,2
advances made todays hearing,advances,made,todays,hearing,2
advise risk deportation pled,advise,risk,deportation,pled,2
affairs last month learned,affairs,last,month,learned,2
affect private property owners,affect,private,property,owners,2
afghanistan repeated brigade new,afghanistan,repeated,brigade,new,2
africanamerican female quilters featuring,africanamerican,female,quilters,featuring,2
afro rests johannes brahms,afro,rests,johannes,brahms,2
afroamerican museum cultural center,afroamerican,museum,cultural,center,2
afscme american federation state,afscme,american,federation,state,2
aftermarket performance car parts,aftermarket,performance,car,parts,2
afternoon police say joseph,afternoon,police,say,joseph,2
age town kansas city,age,town,kansas,city,2
agent acquisition power forward,agent,acquisition,power,forward,2
agent boston washington dc,agent,boston,washington,dc,2
agents luxury apartment istanbul,agents,luxury,apartment,istanbul,2
agents say grow inventory,agents,say,grow,inventory,2
ages years old guardian,ages,years,old,guardian,2
ago help boost effects,ago,help,boost,effects,2
ago much horror women,ago,much,horror,women,2
ago sponsor field car,ago,sponsor,field,car,2
agree likely met may,agree,likely,met,may,2
agreed august cannon receive,agreed,august,cannon,receive,2
agreed come studio meet,agreed,come,studio,meet,2
agreed even close said,agreed,even,close,said,2
agreement restitution either government,agreement,restitution,either,government,2
agreement thus throws city,agreement,thus,throws,city,2
agreement way state slowly,agreement,way,state,slowly,2
agreements treated outliers first,agreements,treated,outliers,first,2
ahead may patiala house,ahead,may,patiala,house,2
ahead time white answered,ahead,time,white,answered,2
aids smaller smarter easier,aids,smaller,smarter,easier,2
aisle campaign charter plane,aisle,campaign,charter,plane,2
akron bob kloos cleveland,akron,bob,kloos,cleveland,2
alarm went pasadena independent,alarm,went,pasadena,independent,2
albala montillamoriles don px,albala,montillamoriles,don,px,2
albert pujols taking deep,albert,pujols,taking,deep,2
albuquerque mountainside behind covered,albuquerque,mountainside,behind,covered,2
alcoholic abusive toward mom,alcoholic,abusive,toward,mom,2
alewife high list doesnt,alewife,high,list,doesnt,2
alhashemi staying protection turkish,alhashemi,staying,protection,turkish,2
aliotti said ‚Äúthings didn‚Äôt,aliotti,said,‚Äúthings,didn‚Äôt,2
alleged security shortcomings two,alleged,security,shortcomings,two,2
allegedly set dorm room,allegedly,set,dorm,room,3
alleges ravi tried influence,alleges,ravi,tried,influence,2
allen said interview took,allen,said,interview,took,2
allen theatre lucky plush,allen,theatre,lucky,plush,2
allens walkoff home run,allens,walkoff,home,run,2
allowing enter back door,allowing,enter,back,door,2
allows higher compensation paid,allows,higher,compensation,paid,2
allstar games knicks last,allstar,games,knicks,last,2
almost billion build expand,almost,billion,build,expand,2
along chipmunks barking dogs,along,chipmunks,barking,dogs,2
along donations rockefeller park,along,donations,rockefeller,park,2
along progression curve overall,along,progression,curve,overall,2
alonso ferrari front two,alonso,ferrari,front,two,2
alphabet print ikea bedroom,alphabet,print,ikea,bedroom,2
alpine gardens vail ohio,alpine,gardens,vail,ohio,2
already canceled plans build,already,canceled,plans,build,2
already china ford committed,already,china,ford,committed,2
already know im cheerleader,already,know,im,cheerleader,2
already made concessions last,already,made,concessions,last,2
also bring yet another,also,bring,yet,another,2
also cited south carolina,also,cited,south,carolina,2
also disputes fundamental underpinning,also,disputes,fundamental,underpinning,2
also feel heat knowing,also,feel,heat,knowing,2
also focused developing defensiveminded,also,focused,developing,defensiveminded,2
also gets upset plans,also,gets,upset,plans,3
also gradelevel lead teacher,also,gradelevel,lead,teacher,2
also great position earn,also,great,position,earn,2
